1.22 . 1.22.01 . 17 . 07 . 5 . 2 . 2 . 11 . 02  , Belanja Makanan Dan Minuman Rapat  ,2125000," Belanja makan minum rapat
Belanja snack minum rapat BBGRM150 ok x 8.500,00 = 1.275.000,00
Belanja snack minum rapat LKD100 ok x 8.500,00 = 850.000,00",
1.22 . 1.22.01 . 17 . 07 . 5 . 2 . 2 . 11 . 05  , Belanja Makanan dan Minuman Pelaksanaan Kegiatan  ,15600000," Belanja makan minum kegiatan
Belanja makan minum snack pencanangan BBGRM350 ok x 20.000,00 = 7.000.000,00
Belanja makan minum snack penutupan BBGRM250 ok x 20.000,00 = 5.000.000,00
Belanja makan minum prasmanan pencanangan BBGRM60 ok x 25.000,00 = 1.500.000,00
Belanja makan minum snack DPD Asosiasi tk Kabupaten140 org x 15.000,00 = 2.100.000,00",
1.22 . 1.22.01 . 17 . 07 . 5 . 2 . 2 . 14  , Belanja Pakaian khusus dan hari-hari tertentu  ,4000000,,
1.22 . 1.22.01 . 17 . 07 . 5 . 2 . 2 . 14 . 03  , Belanja Pakaian Batik Tradisional  ,4000000," Belanja pakaian batik tradisional50 org x 80.000,00 = 4.000.000,00",
1.22 . 1.22.01 . 17 . 08  , Penunjang kegiatan TMMD  ,117900000," Sumber Dana : 
Lokasi Kegiatan : kab. bantul",
1.22 . 1.22.01 . 17 . 08 . 5 . 2 . 1  , Belanja Pegawai  ,43400000,,
1.22 . 1.22.01 . 17 . 08 . 5 . 2 . 1 . 01  , Honorarium PNS  ,43400000,,
1.22 . 1.22.01 . 17 . 08 . 5 . 2 . 1 . 01 . 01  , Honorarium Panitia Pelaksana Kegiatan  ,43400000," Honor Pelaksana Kegiatan
 Hr Petugas Upacara2 pkt x 1.500.000,00 = 3.000.000,00
Hr Petugas Korsik2 pkt x 2.000.000,00 = 4.000.000,00 
Hr Petugas Penyuluhan12 pkt x 200.000,00 = 2.400.000,00
Hr Tim TMMD Sengkuyung 20142 lokasi x 12.000.000,00 = 24.000.000,00
Hr Tim Karya Bhakti TNI 20141 tim x 9.000.000,00 = 9.000.000,00
Hr Jasa Pembuat Gambar-RAB2 pkt x 500.000,00 = 1.000.000,00",
1.22 . 1.22.01 . 17 . 08 . 5 . 2 . 2  , Belanja Barang dan Jasa  ,74500000,,
1.22 . 1.22.01 . 17 . 08 . 5 . 2 . 2 . 01  , Belanja Bahan Pakai Habis  ,500000,,
1.22 . 1.22.01 . 17 . 08 . 5 . 2 . 2 . 01 . 01  , Belanja Alat Tulis Kantor  ,500000," Belanja Bahan Pakai Habis 
Blj Alat Tulis Penunjang Kegiatan1 ls x 500.000,00 = 500.000,00",
1.22 . 1.22.01 . 17 . 08 . 5 . 2 . 2 . 02  , Belanja Bahan/Material  ,2000000,,
1.22 . 1.22.01 . 17 . 08 . 5 . 2 . 2 . 02 . 18  , Belanja Bahan Percontohan  ,2000000," Belanja Bahan / Material
Blj Poskotis Kegiatan TMMD2 pkt x 1.000.000,00 = 2.000.000,00",
1.22 . 1.22.01 . 17 . 08 . 5 . 2 . 2 . 03  , Belanja Jasa Kantor  ,1400000,,
1.22 . 1.22.01 . 17 . 08 . 5 . 2 . 2 . 03 . 14  , Belanja Dekorasi  ,600000," Belanja Dekorasi Kegiatan
Blj Dekorasi Kegiatan2 pkt x 300.000,00 = 600.000,00",
1.22 . 1.22.01 . 17 . 08 . 5 . 2 . 2 . 03 . 15  , Belanja Publikasi  ,800000," Belanja publikasi2 kali x 400.000,00 = 800.000,00",
1.22 . 1.22.01 . 17 . 08 . 5 . 2 . 2 . 06  , Belanja Cetak dan Penggandaan  ,2750000,,
1.22 . 1.22.01 . 17 . 08 . 5 . 2 . 2 . 06 . 01  , Belanja Cetak  ,2000000," Belanja Cetak
Blj Cetak Undangan800 lbr x 2.500,00 = 2.000.000,00",
1.22 . 1.22.01 . 17 . 08 . 5 . 2 . 2 . 06 . 02  , Belanja Penggandaan  ,750000," Belanja Penggandaan
Blj Fotocopy Penunjang kegiatan5,000 lbr x 150,00 = 750.000,00",
1.22 . 1.22.01 . 17 . 08 . 5 . 2 . 2 . 08  , Belanja Sewa Sarana Mobilitas  ,2000000,,
1.22 . 1.22.01 . 17 . 08 . 5 . 2 . 2 . 08 . 01  , Belanja Sewa Sarana Mobilitas Darat  ,2000000," Belanja Sewa Sarana Mobilitas 
Blj Sewa Sarana Mobilitas Darat4 lokasi x 500.000,00 = 2.000.000,00",
1.22 . 1.22.01 . 17 . 08 . 5 . 2 . 2 . 10  , Belanja Sewa Perlengkapan dan Peralatan Kantor  ,3000000,,
1.22 . 1.22.01 . 17 . 08 . 5 . 2 . 2 . 10 . 05  , Belanja Sewa Tenda  ,3000000," Belanja Sewa Perlengk Peralatan Kantor
Blj Sewa Tenda2 lokasi x 1.500.000,00 = 3.000.000,00",
1.22 . 1.22.01 . 17 . 08 . 5 . 2 . 2 . 11  , Belanja Makanan dan Minuman  ,41690000,,
1.22 . 1.22.01 . 17 . 08 . 5 . 2 . 2 . 11 . 02  , Belanja Makanan Dan Minuman Rapat  ,7020000,"   Belanja makan minum rapat
Minum minum rakor390 ok x 18.000,00 = 7.020.000,00",
1.22 . 1.22.01 . 17 . 08 . 5 . 2 . 2 . 11 . 03  , Belanja Makanan Dan Minuman Tamu  ,20400000," Belanja makan minum tamu
Minum Snack Peserta Upacara TMMD800 ok x 8.500,00 = 6.800.000,00 
Makan . Minum, Snack Tamu TMMD500 ok x 20.000,00 = 10.000.000,00
Makan Minum ,Upcr Karya Bhakti TNI200 ok x 18.000,00 = 3.600.000,00",
1.22 . 1.22.01 . 17 . 08 . 5 . 2 . 2 . 11 . 05  , Belanja Makanan dan Minuman Pelaksanaan Kegiatan  ,14270000," Makan minum kegiatan
Snack Minum Penyuluhan320 ok x 8.500,00 = 2.720.000,00 
Makan Minum Gladi Bersih150 ok x 20.000,00 = 3.000.000,00
Makan Snack Minum Survey100 ok x 20.000,00 = 2.000.000,00
Makan Minum ,Snec Sosialisasi200 ok x 20.000,00 = 4.000.000,00
Snack dan Minum Malam Perpisahan300 paket x 8.500,00 = 2.550.000,00",
1.22 . 1.22.01 . 17 . 08 . 5 . 2 . 2 . 13  , Belanja Pakaian Kerja  ,5000000,,
1.22 . 1.22.01 . 17 . 08 . 5 . 2 . 2 . 13 . 01  , Belanja Pakaian Kerja Lapangan  ,5000000," Belanja pakaian kerja100 potong x 50.000,00 = 5.000.000,00",
1.22 . 1.22.01 . 17 . 08 . 5 . 2 . 2 . 35  ," Jasa Narasumber, Tenaga Ahli, Yuri, Entry Data, Petugas Fogging dan Petugas Lapangan ",16160000,,
1.22 . 1.22.01 . 17 . 08 . 5 . 2 . 2 . 35 . 01  , Jasa Nara Sumber/Moderator/Tenaga Ahli  ,11360000," Belanja honor nara sumber
Hr Instruktur/Nara Sumber Moderatorkegiatan Penyuluhan32 ok x 250.000,00 = 8.000.000,00
Honor Monitoring54 ok x 40.000,00 = 2.160.000,00
Honor Moderator PembukaanPenutupan TMMD Sengkuyung4 ok x 250.000,00 = 1.000.000,00
Honor narasumber talkshow2 kali x 100.000,00 = 200.000,00",
1.22 . 1.22.01 . 17 . 08 . 5 . 2 . 2 . 35 . 05  , Jasa Peserta Seminar/Simposium /Workshop/Sosialisasi  ,4800000," Honor Harian Peserta
Hr Harian Peserta Penyuluhan320 ok x 15.000,00 = 4.800.000,00",
1.22 . 1.22.01 . 17 . 11  , Musrenbang tingkat kecamatan  ,19990000," Sumber Dana : 
Lokasi Kegiatan : kab. bantul",
1.22 . 1.22.01 . 17 . 11 . 5 . 2 . 1  , Belanja Pegawai  ,12040000,,
1.22 . 1.22.01 . 17 . 11 . 5 . 2 . 1 . 01  , Honorarium PNS  ,12040000,,
1.22 . 1.22.01 . 17 . 11 . 5 . 2 . 1 . 01 . 01  , Honorarium Panitia Pelaksana Kegiatan  ,12040000," Honorarium Panitia pelaksana kegiatan
Honor Tim Koordinasi Musrenbang Kecamatan1 bjj x 10.000.000,00 = 10.000.000,00
Honor Tim monitoring51 ok x 40.000,00 = 2.040.000,00",
1.22 . 1.22.01 . 17 . 11 . 5 . 2 . 2  , Belanja Barang dan Jasa  ,7950000,,
1.22 . 1.22.01 . 17 . 11 . 5 . 2 . 2 . 01  , Belanja Bahan Pakai Habis  ,500000,,
1.22 . 1.22.01 . 17 . 11 . 5 . 2 . 2 . 01 . 01  , Belanja Alat Tulis Kantor  ,500000," Belanja Alat Tulis Kantor1 pkt x 500.000,00 = 500.000,00",
1.22 . 1.22.01 . 17 . 11 . 5 . 2 . 2 . 03  , Belanja Jasa Kantor  ,150000,,
1.22 . 1.22.01 . 17 . 11 . 5 . 2 . 2 . 03 . 14  , Belanja Dekorasi  ,150000," Belanja dekorasi1 pkt x 150.000,00 = 150.000,00",
1.22 . 1.22.01 . 17 . 11 . 5 . 2 . 2 . 06  , Belanja Cetak dan Penggandaan  ,1200000,,
1.22 . 1.22.01 . 17 . 11 . 5 . 2 . 2 . 06 . 02  , Belanja Penggandaan  ,1200000," Belanja Penggandaan8,000 Lb x 150,00 = 1.200.000,00",
1.22 . 1.22.01 . 17 . 11 . 5 . 2 . 2 . 10  , Belanja Sewa Perlengkapan dan Peralatan Kantor  ,1000000,,
1.22 . 1.22.01 . 17 . 11 . 5 . 2 . 2 . 10 . 05  , Belanja Sewa Tenda  ,1000000,"  Belanja Sewa Tenda1 paket x 1.000.000,00 = 1.000.000,00",
1.22 . 1.22.01 . 17 . 11 . 5 . 2 . 2 . 11  , Belanja Makanan dan Minuman  ,5100000,,
1.22 . 1.22.01 . 17 . 11 . 5 . 2 . 2 . 11 . 02  , Belanja Makanan Dan Minuman Rapat  ,1500000," Belanja makan dan minum Rapat100 ok x 15.000,00 = 1.500.000,00",
1.22 . 1.22.01 . 17 . 11 . 5 . 2 . 2 . 11 . 05  , Belanja Makanan dan Minuman Pelaksanaan Kegiatan  ,3600000," Belanja Makan dan minuman pelaksanaan Kegiatan200 ok x 18.000,00 = 3.600.000,00",
1.22 . 1.22.01 . 17 . 13  , Bantul Ekspo dan karnaval  ,14900000," Sumber Dana : 
Lokasi Kegiatan : kab. bantul",
1.22 . 1.22.01 . 17 . 13 . 5 . 2 . 1  , Belanja Pegawai  ,2400000,,
1.22 . 1.22.01 . 17 . 13 . 5 . 2 . 1 . 01  , Honorarium PNS  ,1800000,,
1.22 . 1.22.01 . 17 . 13 . 5 . 2 . 1 . 01 . 01  , Honorarium Panitia Pelaksana Kegiatan  ,1800000," Honorarium Panitia Pelaksana Kegiatan
Honorarium peserta Jaga Bantul Exspo36 oh x 50.000,00 = 1.800.000,00",
1.22 . 1.22.01 . 17 . 13 . 5 . 2 . 1 . 03  , Uang Lembur  ,600000,,
1.22 . 1.22.01 . 17 . 13 . 5 . 2 . 1 . 03 . 01  , Uang Lembur PNS  ,600000,"  Uang lembur PNS
Honor lembur harian dalam rangka Keg Btl Exspo20 oh x 15.000,00 = 300.000,00
Honor lembur harian dalam rangka Keg Carnaval20 oh x 15.000,00 = 300.000,00",
1.22 . 1.22.01 . 17 . 13 . 5 . 2 . 2  , Belanja Barang dan Jasa  ,12500000,,
1.22 . 1.22.01 . 17 . 13 . 5 . 2 . 2 . 03  , Belanja Jasa Kantor  ,7500000,,
1.22 . 1.22.01 . 17 . 13 . 5 . 2 . 2 . 03 . 14  , Belanja Dekorasi  ,7500000," Belanja Dekorasi
Dekorasi Bantul Exspo1 pkt x 4.000.000,00 = 4.000.000,00
Dekorasi Bantul Carnaval1 pkt x 3.500.000,00 = 3.500.000,00",
1.22 . 1.22.01 . 17 . 13 . 5 . 2 . 2 . 06  , Belanja Cetak dan Penggandaan  ,375000,,
1.22 . 1.22.01 . 17 . 13 . 5 . 2 . 2 . 06 . 01  , Belanja Cetak  ,375000," Belanja cetak
 Belanja penggandaan Riflet2,500 lbr x 150,00 = 375.000,00",
1.22 . 1.22.01 . 17 . 13 . 5 . 2 . 2 . 07  , Belanja Sewa Rumah/Gedung/Gudang/Parkir  ,900000,,
1.22 . 1.22.01 . 17 . 13 . 5 . 2 . 2 . 07 . 02  , Belanja Sewa Gedung/Kantor/Tempat  ,900000," Sewa tempat Bantul Exspo 1 unit x 900.000,00 = 900.000,00",
1.22 . 1.22.01 . 17 . 13 . 5 . 2 . 2 . 08  , Belanja Sewa Sarana Mobilitas  ,1000000,,
1.22 . 1.22.01 . 17 . 13 . 5 . 2 . 2 . 08 . 01  , Belanja Sewa Sarana Mobilitas Darat  ,1000000," Belanja sewa Sarana Mobilitas Darat
Belanja sewa kendaraan Alat angkut keg. Btl Exspo2 hr x 250.000,00 = 500.000,00
Belanja sewa kendaraan Alat angkut keg. Carnaval2 hr x 250.000,00 = 500.000,00",
1.22 . 1.22.01 . 17 . 13 . 5 . 2 . 2 . 11  , Belanja Makanan dan Minuman   Belanja makanan dan minuman rapat,1775000,,
1.22 . 1.22.01 . 17 . 13 . 5 . 2 . 2 . 11 . 02  , Belanja Makanan Dan Minuman Rapat  ,255000," Belanja snek dan minum rakor15 org x 8.500,00 = 127.500,00
Belanja snek & minum rakor persiapan Carnaval15 org x 8.500,00 = 127.500,00",
1.22 . 1.22.01 . 17 . 13 . 5 . 2 . 2 . 11 . 04  , Belanja makanan dan minuman Lembur  ,1520000," Belanja makan dan minum lembur
Belanja Makan dan minum Jaga Bantul Exspo36 org x 20.000,00 = 720.000,00
Belanja makan & mnm lembur dlm Rangka Btl Exspo20 oh x 20.000,00 = 400.000,00
Belanja makan & mnm lembur dlm Rangka Carnaval20 oh x 20.000,00 = 400.000,00",
1.22 . 1.22.01 . 17 . 13 . 5 . 2 . 2 . 23  , Belanja Barang Untuk Diserahkan kepada Masyarakat/Pihak Ketiga  ,950000,,
1.22 . 1.22.01 . 17 . 13 . 5 . 2 . 2 . 23 . 01  , Belanja Barang Yang Akan Diserahkan Kepada Masyarakat  ,950000," Belanja Barang yang diserahkan kepada masyarakat
Belanja Hadiah Bantul Exspo1 LS x 950.000,00 = 950.000,00",
1.22 . 1.22.01 . 17 . 14  , Pengembangan desa siaga  ,17500000," Sumber Dana : 
Lokasi Kegiatan : kab. bantul",
1.22 . 1.22.01 . 17 . 14 . 5 . 2 . 1  , Belanja Pegawai  ,6830000,,
1.22 . 1.22.01 . 17 . 14 . 5 . 2 . 1 . 01  , Honorarium PNS  ,6830000,,
1.22 . 1.22.01 . 17 . 14 . 5 . 2 . 1 . 01 . 01  , Honorarium Panitia Pelaksana Kegiatan  ,6830000," Honorarium panitia pelaksana kegiatan
Honor panitia sosialisasi desa siaga dan kelembagaan1 BJJ x 330.000,00 = 330.000,00
Honor Tim pelaksana desa siaga1 bjj x 6.500.000,00 = 6.500.000,00",
1.22 . 1.22.01 . 17 . 14 . 5 . 2 . 2  , Belanja Barang dan Jasa  ,10670000,,
1.22 . 1.22.01 . 17 . 14 . 5 . 2 . 2 . 01  , Belanja Bahan Pakai Habis  ,1440000,,
1.22 . 1.22.01 . 17 . 14 . 5 . 2 . 2 . 01 . 01  , Belanja Alat Tulis Kantor  ,1440000," Belanja ATK
Belanja ATK peserta sosialisasi120 ok x 12.000,00 = 1.440.000,00",
1.22 . 1.22.01 . 17 . 14 . 5 . 2 . 2 . 06  , Belanja Cetak dan Penggandaan  ,1200000,,
1.22 . 1.22.01 . 17 . 14 . 5 . 2 . 2 . 06 . 02  , Belanja Penggandaan  ,1200000," Belanja penggandaan
Belanja penggandaan materi sosialisasi5,000 lbr x 150,00 = 750.000,00
Belanja fotocopi kegiatan3,000 lbr x 150,00 = 450.000,00",
1.22 . 1.22.01 . 17 . 14 . 5 . 2 . 2 . 11  , Belanja Makanan dan Minuman  ,3880000,,
1.22 . 1.22.01 . 17 . 14 . 5 . 2 . 2 . 11 . 05  , Belanja Makanan dan Minuman Pelaksanaan Kegiatan  ,3880000," Belanja makan minum kegiatan
Belanja makan minum snack sosialisasi desa siaga140 ok x 17.000,00 = 2.380.000,00
Belanja makan minum snack rakor desa siaga100 ok x 15.000,00 = 1.500.000,00",
1.22 . 1.22.01 . 17 . 14 . 5 . 2 . 2 . 35  ," Jasa Narasumber, Tenaga Ahli, Yuri, Entry Data, Petugas Fogging dan Petugas Lapangan ",4150000,,
1.22 . 1.22.01 . 17 . 14 . 5 . 2 . 2 . 35 . 01  , Jasa Nara Sumber/Moderator/Tenaga Ahli  ,1750000," Honorarium narasumber/ instrukstur/ tenaga ahli
Honorarium sosialisasi desa siaga dan kelembagaan7 JPL x 250.000,00 = 1.750.000,00",
1.22 . 1.22.01 . 17 . 14 . 5 . 2 . 2 . 35 . 05  , Jasa Peserta Seminar/Simposium /Workshop/Sosialisasi  ,2400000," Honorarium peserta sosialisasi desa siaga dan kelembagaan
Honorarium peserta120 org x 20.000,00 = 2.400.000,00",
1.22 . 1.22.01 . 19  , Program peningkatan peran perempuan di perdesaan  ,69880000,,
1.22 . 1.22.01 . 19 . 02  , Peningkatan Peranan Wanita Menuju keluarga Sehat sejahtera ( P2WKSS) ,69880000," Sumber Dana : 
Lokasi Kegiatan : 6 desa",
1.22 . 1.22.01 . 19 . 02 . 5 . 2 . 1  , Belanja Pegawai  ,6620000,,
1.22 . 1.22.01 . 19 . 02 . 5 . 2 . 1 . 01  , Honorarium PNS  ,6620000,,
1.22 . 1.22.01 . 19 . 02 . 5 . 2 . 1 . 01 . 01  , Honorarium Panitia Pelaksana Kegiatan  ,6620000," Honor Panitia Pelaksana kegiatan
Honor Panitia pengenalan program P2W-KSS 2 Angkatan x 3 ok1 BJJ x 620.000,00 = 620.000,00
Honor Tim Pelaksana supervisi dan evaluasi P2W-KSS1 BJJ x 6.000.000,00 = 6.000.000,00",
1.22 . 1.22.01 . 19 . 02 . 5 . 2 . 2  , Belanja Barang dan Jasa  ,63260000,,
1.22 . 1.22.01 . 19 . 02 . 5 . 2 . 2 . 01  , Belanja Bahan Pakai Habis  ,3360000,,
1.22 . 1.22.01 . 19 . 02 . 5 . 2 . 2 . 01 . 01  , Belanja Alat Tulis Kantor  ,3360000," Belanja alat tulis kantor
Belanja alat tulis kegiatan1 paket x 720.000,00 = 720.000,00
Belanja ATK peserta220 ok x 12.000,00 = 2.640.000,00",
1.22 . 1.22.01 . 19 . 02 . 5 . 2 . 2 . 03  , Belanja Jasa Kantor  ,240000,,
1.22 . 1.22.01 . 19 . 02 . 5 . 2 . 2 . 03 . 14  , Belanja Dekorasi  ,240000," Belanja dekorasi2 kali x 120.000,00 = 240.000,00",
1.22 . 1.22.01 . 19 . 02 . 5 . 2 . 2 . 06  , Belanja Cetak dan Penggandaan  ,3360000,,
1.22 . 1.22.01 . 19 . 02 . 5 . 2 . 2 . 06 . 01  , Belanja Cetak  ,2640000," Belanja cetak220 ok x 12.000,00 = 2.640.000,00",
1.22 . 1.22.01 . 19 . 02 . 5 . 2 . 2 . 06 . 02  , Belanja Penggandaan  ,720000," Belanja penggandaan
Belanja penggandaan buku administrasi P2W-KSS8 buku x 15.000,00 = 120.000,00
Biaya fotocopi kegiatan4,000 lbr x 150,00 = 600.000,00",
1.22 . 1.22.01 . 19 . 02 . 5 . 2 . 2 . 11  , Belanja Makanan dan Minuman  ,28200000,,
1.22 . 1.22.01 . 19 . 02 . 5 . 2 . 2 . 11 . 05  , Belanja Makanan dan Minuman Pelaksanaan Kegiatan  ,28200000," Belanja makan minum kegiatan
Belanja makan minum snack peserta warga binaan pengenalan program P2W-KSS260 ok x 20.000,00 = 5.200.000,00
Belanja makan minum kegiatan P2W-KSS150 ok x 20.000,00 = 3.000.000,00
Belanja makan minum snack pada desa binaan dan desa lanjutan350 ok x 20.000,00 = 7.000.000,00
Belanja makan minum snack penyelenggaraan supervisi tk kabupaten pada 2 desa400 ok x 20.000,00 = 8.000.000,00
Belanja makan minum snack penyelenggaraan supervisi tk propinsi250 ok x 20.000,00 = 5.000.000,00",
1.22 . 1.22.01 . 19 . 02 . 5 . 2 . 2 . 35  ," Jasa Narasumber, Tenaga Ahli, Yuri, Entry Data, Petugas Fogging dan Petugas Lapangan ",10100000,,
1.22 . 1.22.01 . 19 . 02 . 5 . 2 . 2 . 35 . 01  , Jasa Nara Sumber/Moderator/Tenaga Ahli  ,3500000," Honorarium narasumber/moderator/tenaga ahli
Honorarium narasumber/pelatih waraga binaan P2W-KSS14 JPL x 250.000,00 = 3.500.000,00",
1.22 . 1.22.01 . 19 . 02 . 5 . 2 . 2 . 35 . 05  , Jasa Peserta Seminar/Simposium /Workshop/Sosialisasi  ,6600000," Honor peserta Pengenalan Program P2W-KSS220 ok x 30.000,00 = 6.600.000,00",
1.22 . 1.22.01 . 19 . 02 . 5 . 2 . 2 . 37  , Uang Untuk Diberikan Kepada Pihak Ketiga/Masyarakat  ,18000000,,
1.22 . 1.22.01 . 19 . 02 . 5 . 2 . 2 . 37 . 01  , Uang Untuk Diberikan Kepada Pihak Ketiga/Masyarakat  ,18000000," Belanja Uang untuk diberikan kepada masyarakat
Hadiah Juara I Lomba P2W-KSS1 desa x 10.000.000,00 = 10.000.000,00
Hadiah Juara II Lomba P2W-KSS1 desa x 8.000.000,00 = 8.000.000,00",
1.11 . 1.22.01 . 20  , Program Pemberdayaan Perempuan  ,159810000,,
1.11 . 1.22.01 . 20 . 16  , Operasional PKK kabupaten  ,159810000," Sumber Dana : 
Lokasi Kegiatan : Kabupaten Bantul",
1.11 . 1.22.01 . 20 . 16 . 5 . 2 . 1  , Belanja Pegawai  ,9550000,,
1.11 . 1.22.01 . 20 . 16 . 5 . 2 . 1 . 01  , Honorarium PNS  ,9550000,,
1.11 . 1.22.01 . 20 . 16 . 5 . 2 . 1 . 01 . 01  , Honorarium Panitia Pelaksana Kegiatan  ,9550000," Honorarium panitia kegiatan
honorarium panitia pembinaan administrasi Posyandu5 ok x 50.000,00 = 250.000,00
honorarium panitia pemantauan pelaksanaan Posyandu SCB24 ok x 50.000,00 = 1.200.000,00
honorarium panitia rakor pokja IV8 ok x 50.000,00 = 400.000,00
honorarium panitia pemantapan kegiatan Posyandu SCB7 ok x 50.000,00 = 350.000,00
honorarium panitia sosialisasi pemanfaatan hasil toga5 ok x 50.000,00 = 250.000,00
honorarium panitia penyuluhan pemanfaatan tanah pekarangan7 ok x 50.000,00 = 350.000,00
honorarium panitia sosialisasi rumah layak huni (P2WKSS)6 ok x 50.000,00 = 300.000,00
honorarium panitia sosialisasi B2SA5 ok x 50.000,00 = 250.000,00
honorarium panitia kegiatan rakor pokja III6 ok x 50.000,00 = 300.000,00
honorarium panitia pembinaan Hatinya PKK7 ok x 50.000,00 = 350.000,00
honorarium panitia pemberdayaan KWT5 ok x 50.000,00 = 250.000,00
honorarium panitia pelatihan membuat APE5 ok x 50.000,00 = 250.000,00
honorarium panitia lomba membuat APE5 ok x 50.000,00 = 250.000,00
honorarium panitia pelatihan membuat asesoris5 ok x 50.000,00 = 250.000,00
Honor panitia penyelenggara monev 10 program pokok PKK14 ok x 50.000,00 = 700.000,00
honorarium penyelenggara kegiatan pelatihan capacity building6 ok x 50.000,00 = 300.000,00
honorarium panitia pelatihan simulasi Pola asuh anak peningkatan kesadaran bela negara7 ok x 50.000,00 = 350.000,00
Honorarium Operasional PKK48 Ob x 50.000,00 = 2.400.000,00
Honor Panitia Penyelenggara HKG PKK10 ok x 50.000,00 = 500.000,00
Honor panitia penyelenggara rakor sekretaris6 ok x 50.000,00 = 300.000,00",
1.11 . 1.22.01 . 20 . 16 . 5 . 2 . 2  , Belanja Barang dan Jasa  ,150260000,,
1.11 . 1.22.01 . 20 . 16 . 5 . 2 . 2 . 01  , Belanja Bahan Pakai Habis  ,5652000,,
1.11 . 1.22.01 . 20 . 16 . 5 . 2 . 2 . 01 . 01  , Belanja Alat Tulis Kantor  ,5652000," Belanja ATK
Belanja ATK Operasional PKK1 Ls x 2.889.500,00 = 2.889.500,00
Belanja ATK bahan pemantapan kegiatan Posyandu SCB1 ls x 370.000,00 = 370.000,00
Belanja ATK peserta pelatihan capacity building 125 orang125 ok x 4.200,00 = 525.000,00
Belanja ATK ketrampilan membuat asesoris1 ls x 150.000,00 = 150.000,00
Belanja ATK Rakor Pokja II1 ls x 150.000,00 = 150.000,00
Belanja ATK Rakor Pokja IV1 ls x 205.000,00 = 205.000,00
Belanja ATK simulasi Pola asuh anak Peningkatan Kesadaran Bela Negara1 ls x 100.000,00 = 100.000,00
Belanja ATK pelatihan membuat APE1 ls x 150.000,00 = 150.000,00
belanja ATK lomba membuat APE1 ls x 150.000,00 = 150.000,00
Belanja ATK sosialisasi penyuluhan hukum1 ls x 100.000,00 = 100.000,00
Belanja ATK rakor pokja I1 ls x 100.000,00 = 100.000,00
Belanja ATK pelatihan administrasi KDRT1 ls x 100.000,00 = 100.000,00
Belanja ATK HKG1 ls x 300.000,00 = 300.000,00
Belanja ATK monev 10 program pokok PKK1 Ls x 200.000,00 = 200.000,00
Belanja ATK pelatihan capacity building1 ls x 162.500,00 = 162.500,00",
1.11 . 1.22.01 . 20 . 16 . 5 . 2 . 2 . 02  , Belanja Bahan/Material  ,4800000,,
1.11 . 1.22.01 . 20 . 16 . 5 . 2 . 2 . 02 . 01  , Belanja Bahan Baku Bangunan  ,1250000," Belanja bahan genting kaca
belanja bahan genting kaca pokja III100 buah x 12.500,00 = 1.250.000,00",
1.11 . 1.22.01 . 20 . 16 . 5 . 2 . 2 . 02 . 02  , Belanja Bahan/Bibit Tanaman  ,500000," Belanja bibit tanaman
belanja bibit TOGA pokja III1 paket x 500.000,00 = 500.000,00",
1.11 . 1.22.01 . 20 . 16 . 5 . 2 . 2 . 02 . 07  , Belanja Cindera Mata  ,850000," Belanja cinderamataBelanja cinderamata PKK5 buah x 170.000,00 = 850.000,00",
1.11 . 1.22.01 . 20 . 16 . 5 . 2 . 2 . 02 . 08  , Belanja Bahan Makanan  ,1400000," Belanja bahan makanan
belanja bahan sosialisasi B2SA1 paket x 1.400.000,00 = 1.400.000,00",
1.11 . 1.22.01 . 20 . 16 . 5 . 2 . 2 . 02 . 12  , Belanja alat-alat/perlengkapan  ,800000," belanja bahan pelatihan
belanja bahan pelatihan ketrampilan membuat asesoris1 paket x 400.000,00 = 400.000,00
belanja bahan pelatihan membuat APE1 paket x 400.000,00 = 400.000,00",
1.11 . 1.22.01 . 20 . 16 . 5 . 2 . 2 . 03  , Belanja Jasa Kantor  ,1950000,,
1.11 . 1.22.01 . 20 . 16 . 5 . 2 . 2 . 03 . 14  , Belanja Dekorasi  ,1950000," Belanja dekoras
iBelanaj dekorasi Puncar acara HKG1 paket x 1.500.000,00 = 1.500.000,00
Belanja dekorasi pelatohan membuat APE1 paket x 150.000,00 = 150.000,00
Belanja dekorasi lomba membuat APE1 paket x 150.000,00 = 150.000,00
Belanja dekorasi pelatihan ketrampilan membuat asesoris1 paket x 150.000,00 = 150.000,00",
1.11 . 1.22.01 . 20 . 16 . 5 . 2 . 2 . 06  , Belanja Cetak dan Penggandaan  ,8693000,,
1.11 . 1.22.01 . 20 . 16 . 5 . 2 . 2 . 06 . 01  , Belanja Cetak  ,1100000," Belanja cetak
belanja cetak undangan HKG300 buah x 2.000,00 = 600.000,00
Belanja cetak data dinding PKK1 ls x 500.000,00 = 500.000,00",
1.11 . 1.22.01 . 20 . 16 . 5 . 2 . 2 . 06 . 02  , Belanja Penggandaan  ,7593000," Belanja Fotocopy
belanja fotocopy pelaksanaan HKG6,700 lbr x 150,00 = 1.005.000,00
belanja fotocopy pemanatauan pelaksanaan posyandu1,500 lbr x 150,00 = 225.000,00
belanja fotocopy sosialisasi pemanfaatan hasil Toga420 lembar x 150,00 = 63.000,00
belanja fotocopy pelatihan etika berbusana1,000 lbr x 150,00 = 150.000,00
belanja fotocopy pemberdayaan KWT1,000 lbr x 150,00 = 150.000,00
belanja fotocopy pembinaan administrasi posyandu2,000 lbr x 150,00 = 300.000,00
belanja fotocopy pelatihan membuat asesoris1,000 lbr x 150,00 = 150.000,00
belanja fotocopy rakor pokja II1,000 lb/r x 150,00 = 150.000,00
belanja fotocopy rakor pokja III1,000 lbr x 150,00 = 150.000,00
belanja fotocopy lomba simulasi KDRT200 lbr x 150,00 = 30.000,00
belanja fotocopy pelatihan membuat APE1,000 lbr x 150,00 = 150.000,00
belanja fotocopy lomba membuat APE1,000 lbr x 150,00 = 150.000,00
belanja fotocopy pelatihan capacity buiding1,000 lbr x 150,00 = 150.000,00
belanja fotocopy kegiatan sosialisasi penyuluhan hukum1,000 lbr x 150,00 = 150.000,00
belanja fotocopy Rakor Pokja I500 lbr x 150,00 = 75.000,00
belanja fotocopy operasional sekretariat PKK27,500 lbr x 150,00 = 4.125.000,00
belanja fotocopy rakor sekretaris1,000 lbr x 150,00 = 150.000,00
belanja fotocopy pelaksanaan monev 10 program pokok PKK1,800 lbr x 150,00 = 270.000,00",
1.11 . 1.22.01 . 20 . 16 . 5 . 2 . 2 . 11  , Belanja Makanan dan Minuman  ,85980000,,
1.11 . 1.22.01 . 20 . 16 . 5 . 2 . 2 . 11 . 02  , Belanja Makanan Dan Minuman Rapat  ,24100000," Belanja makan minum rapat
Belanja snack minum rapat persiapan pencangan HKG40 Ok x 7.500,00 = 300.000,00
Belanja snack minum rapat persiapan pelatihan capacity building15 ok x 7.500,00 = 112.500,00
belanja snack minum rapat persiapan sosialisasi rumah layak huni10 ok x 7.500,00 = 75.000,00
belanja snack minum rapat persiapan sosialisasi B2SA10 ok x 7.500,00 = 75.000,00
belanja snack makan minum rakor pokja IV175 ok x 25.000,00 = 4.375.000,00
belanja snack minum persiapan pelatihan simulasi pola asuh anak10 ok x 7.500,00 = 75.000,00
belanja makan minum rakor pokja II100 ok x 17.500,00 = 1.750.000,00
belanja snack minum rakor pokja III100 ok x 7.500,00 = 750.000,00
belanja snack minum rapat persiapan rakor pokja I10 ok x 7.500,00 = 75.000,00
belanja snack makan minum rakor pokja I110 ok x 25.000,00 = 2.750.000,00
belanja snack minum rapat persiapan lomba simulasi KDRT10 ok x 7.500,00 = 75.000,00
Belanja snack makan minum Rakor Sekretaris50 ok x 25.000,00 = 1.250.000,00
Belanja snack minum rapat persiapan monev 10 program pokok pkk25 ok x 7.500,00 = 187.500,00
belanja snack minum rapat persiapan sosiaslisasi penyuluhan hukum10 ok x 7.500,00 = 75.000,00
Belanja snack minum rapat persiapan puncak acara HKG40 ok x 7.500,00 = 300.000,00
Belanja snack minum operasional PKK615 ok x 7.500,00 = 4.612.500,00
Belanja makan minum operasional PKK415 ok x 17.500,00 = 7.262.500,00",
