1.22 . 1.22.01 . 16.11 . 5.2.2.34 ,Honorarium Pelaksanaan Kegiatan ,625000.00,625000.00,0.00,0.00,
1.22 . 1.22.01 . 16.11 . 5.2.2.34.05 ,Honor Peserta Seminar/Simposium /Workshop/Sosialisasi,625000.00,625000.00,0.00,0.00,"Honor peserta Rapat Koordinasi50 orang x 12.500,00 = 625.000,00"
1.22 . 1.22.01 . 17 ,Program Peningkatan Partisipasi Masyarakat Dalam Membangun Desa,853465000.00,1056427400.00,202962400.00,23.78,
1.22 . 1.22.01 . 17.02 ,Pelaksanaan Musyawarah Pembangunan Desa ,40000000.00,40000000.00,0.00,0.00,"Sumber Dana : 
Lokasi Kegiatan : Kab. Bantul"
1.22 . 1.22.01 . 17.02 . 5.2.1 ,Belanja Pegawai ,23400000.00,23400000.00,0.00,0.00,
1.22 . 1.22.01 . 17.02 . 5.2.1.01 ,Honorarium PNS ,23400000.00,23400000.00,0.00,0.00,
1.22 . 1.22.01 . 17.02 . 5.2.1.01.01 ,Honorarium Panitia Pelaksana Kegiatan ,23400000.00,23400000.00,0.00,0.00,"Honorarium Panitia Pelaksana Kegiatan
Honor Tim Musrenbangdes1 bjj x 22.650.000,00 = 22.650.000,00
Honor panitia sosialisasi musrenbangdes10 OK x 75.000,00 = 750.000,00"
1.22 . 1.22.01 . 17.02 . 5.2.2 ,Belanja Barang dan Jasa ,16600000.00,16600000.00,0.00,0.00,
1.22 . 1.22.01 . 17.02 . 5.2.2.01 ,Belanja Bahan Pakai Habis ,1500000.00,1500000.00,0.00,0.00,
1.22 . 1.22.01 . 17.02 . 5.2.2.01.01 ,Belanja Alat Tulis Kantor ,1500000.00,1500000.00,0.00,0.00,"Belanja Alat Tulis Kantor1 pkt x 1.500.000,00 = 1.500.000,00"
1.22 . 1.22.01 . 17.02 . 5.2.2.03 ,Belanja Jasa Kantor ,800000.00,800000.00,0.00,0.00,
1.22 . 1.22.01 . 17.02 . 5.2.2.03.14 ,Belanja Dekorasi ,800000.00,800000.00,0.00,0.00,"Belanja Dekorasi  dan Spanduk
Belanja Dekorasi dan Spanduk4 pkt x 200.000,00 = 800.000,00"
1.22 . 1.22.01 . 17.02 . 5.2.2.06 ,Belanja Cetak/Penggandaan/Dokumentasi ,1000000.00,1000000.00,0.00,0.00,
1.22 . 1.22.01 . 17.02 . 5.2.2.06.01 ,Belanja Cetak ,500000.00,500000.00,0.00,0.00,"Belanja Cetak125 lb x 4.000,00 = 500.000,00"
1.22 . 1.22.01 . 17.02 . 5.2.2.06.02 ,Belanja Penggandaan/Foto Copy ,500000.00,500000.00,0.00,0.00,"Belanja Foto Kopy Kegiatan
Belanja Foto copy  Kegiatan4,000 lb x 125,00 = 500.000,00"
1.22 . 1.22.01 . 17.02 . 5.2.2.11 ,Belanja Makanan Dan Minuman ,6800000.00,6800000.00,0.00,0.00,
1.22 . 1.22.01 . 17.02 . 5.2.2.11.02 ,Belanja Makanan Dan Minuman Rapat ,1200000.00,1200000.00,0.00,0.00,"Belanja Makan dan Minum Rapat
 > Makan Minum Rakor / Evaluasi100 ok x 12.000,00 = 1.200.000,00"
1.22 . 1.22.01 . 17.02 . 5.2.2.11.05 ,Belanja makanan dan minuman pelaksanaan kegiatan,5600000.00,5600000.00,0.00,0.00,"Belanja Makan Minum Kegiatan
 > Belanja Makan, Minum Rapat dalam rangka pebukaan Musrenbangdes200 ok x 17.500,00 = 3.500.000,00
 > Belanja Makan, Snack  dan Minum Sosialisasi Musrenbang Des120 Ok x 17.500,00 = 2.100.000,00"
1.22 . 1.22.01 . 17.02 . 5.2.2.15 ,Belanja Perjalanan Dinas ,5600000.00,5600000.00,0.00,0.00,
1.22 . 1.22.01 . 17.02 . 5.2.2.15.01 ,Belanja Perjalanan Dinas Dalam Daerah ,5600000.00,5600000.00,0.00,0.00,"Belanja Perjalanan Dinas Dalam Daerah 
Belanja Perjalanan Dinas Dalam Daerah  Golongan III140 ok x 40.000,00 = 5.600.000,00"
1.22 . 1.22.01 . 17.02 . 5.2.2.34 ,Honorarium Pelaksanaan Kegiatan ,900000.00,900000.00,0.00,0.00,
1.22 . 1.22.01 . 17.02 . 5.2.2.34.01 ,Honorarium Nara Sumber/Moderator/Tenaga Ahli ,900000.00,900000.00,0.00,0.00,"Honor Nara Sumber6 ok x 150.000,00 = 900.000,00"
1.22 . 1.22.01 . 17.05 ,Penunjang program nasional pemberdayaan masyarakat (PNPM),492100000.00,659350000.00,167250000.00,33.99,"Sumber Dana : 
Lokasi Kegiatan : Kabupaten Bantul"
1.22 . 1.22.01 . 17.05 . 5.2.1 ,Belanja Pegawai ,86920000.00,127715000.00,40795000.00,46.93,
1.22 . 1.22.01 . 17.05 . 5.2.1.01 ,Honorarium PNS ,86920000.00,127715000.00,40795000.00,46.93,
1.22 . 1.22.01 . 17.05 . 5.2.1.01.01 ,Honorarium Panitia Pelaksana Kegiatan ,86920000.00,127715000.00,40795000.00,46.93,"Honorarium Panitia Pelaksana Kegiatan
Honor Tim Pembina/Koordinasi PNPM MPd1 tahun x 45.720.000,00 = 45.720.000,00
Honor Tim Sekretariat 12 orang1 tahun x 15.240.000,00 = 15.240.000,00
Honor Panitia Lokakarya PNPM MPd8 ok x 70.000,00 = 560.000,00
Honor Panitia Bimtek peningk kualitas Pengawasan BPUPK bagi UPK12 70000 x 70.000,00 = 840.000,00
Honor Panitia Bimtek Peningkatan Kapasitas BKAD12 oh x 70.000,00 = 840.000,00
Honor Panitia Bimtek Kel SPP24 kali x 70.000,00 = 1.680.000,00
Honor Panitia Bimtek peningk kapasitas pengelolaan keuangan12 ok x 70.000,00 = 840.000,00
Honor Panita Bimtek Pelestarian Hasil PNPM MPd14 oh x 70.000,00 = 980.000,00
Honor Panitia Bimtek Peningk Kapasitas TPK12 oh x 70.000,00 = 840.000,00
Honor Panitia Bimtek Peningk. Kapasitas Lurah14 oh x 70.000,00 = 980.000,00
Honor Tim Penilai Kinerja UPK, TPK, kelompok SPP, BKAD14 oh x 150.000,00 = 2.100.000,00
Honor Tim Uji Petik Penilaian Kinerja UPK, BPUPK, Kel SPP, BKAD21 oh x 150.000,00 = 3.150.000,00
Honor Pemandu study banding6 ok x 200.000,00 = 1.200.000,00
Honor TimMonev Kinerja perkembangan UPK102 ok x 50.000,00 = 5.100.000,00
Honor Tim Pelaksana Expo Jambore UPK Kegiatan PNPM MPd13 org x 200.000,00 = 2.600.000,00
Honor Tim Penilai Lomba Stand dan Kelompok SPP5 org x 250.000,00 = 1.250.000,00
Honor Keamanan Expo Kegiatan PNPM MPd10 oh x 100.000,00 = 1.000.000,00
Honor Petugas Keamanan Jalan Expo Keg PNPM MPd40 org x 50.000,00 = 2.000.000,00
Honor Tim Pembina Tk.Kabupaten1 BJJ x 9.000.000,00 = 9.000.000,00
Honor Tim Pengendali dan satker Tk.Kabupaten1 BJJ x 15.000.000,00 = 15.000.000,00
Honor Tim Pelaksana tk.Kecamatan1 OB x 2.250.000,00 = 2.250.000,00
Honor Pelaksana tk.Desa18 ob x 125.000,00 = 2.250.000,00
Honor Koordinasi pedukuhan147 ob x 75.000,00 = 11.025.000,00
Honor Panitia sosialisasi MP3KI1 BJJ x 520.000,00 = 520.000,00
Honor Pemandu studi banding3 org x 250.000,00 = 750.000,00"
1.22 . 1.22.01 . 17.05 . 5.2.2 ,Belanja Barang dan Jasa ,405180000.00,531635000.00,126455000.00,31.21,
1.22 . 1.22.01 . 17.05 . 5.2.2.01 ,Belanja Bahan Pakai Habis ,44410000.00,64215000.00,19805000.00,44.60,
1.22 . 1.22.01 . 17.05 . 5.2.2.01.01 ,Belanja Alat Tulis Kantor ,44410000.00,64215000.00,19805000.00,44.60,"Belanja Alat Tulis Kegiatan
Belanja ATK (Tas, agenda,bolpoin) Peserta Lokakarya PNPM MPd125 set x 70.000,00 = 8.750.000,00
Belanja Alat Tulis Peserta Bimtek Peningk kualitas Pengawasan BPUPK bagi UPK51 set x 30.000,00 = 1.530.000,00
Belanja Alat Tulis Peserta Bimtek Peningk. Kapasitas BKAD51 set x 30.000,00 = 1.530.000,00
Belanja Alat Tulis Peserta Bimtek Kel SPP240 set x 30.000,00 = 7.200.000,00
Belanja ATK Peserta Bimtek Peningk Kapasitas Pengel Keu68 set x 30.000,00 = 2.040.000,00
Belanja Alat Tulis Peserta Bimtek Pelestarian Hasil PNPM MPd75 set x 30.000,00 = 2.250.000,00
Belanja ATK Bimtek Peningk Kapasitas TPK50 set x 30.000,00 = 1.500.000,00
Belanja ATK peserta keg. BKAD4 pkt x 200.000,00 = 800.000,00
Belanja ATK peserta Bimtek Peningk Kapasitas Lurah75 set x 30.000,00 = 2.250.000,00
Belanja ATK Kegiatan1 ls x 9.600.000,00 = 9.600.000,00
Belanja ATK(tas, agenda, bolpoin) study banding58 org x 120.000,00 = 6.960.000,00
Belanja ATK ( Tas, Buku agenda, bolpoin) sosialisasi MP3KI70 set x 140.000,00 = 9.800.000,00
Belanja ATK ( Tas, Buku agenda, bolpoin) studi banding MP3KI60 set x 140.000,00 = 8.400.000,00
Belanja ATK kegiatan1 LS x 1.605.000,00 = 1.605.000,00"
1.22 . 1.22.01 . 17.05 . 5.2.2.02 ,Belanja Bahan/Material ,35100000.00,35600000.00,500000.00,1.42,
1.22 . 1.22.01 . 17.05 . 5.2.2.02.07 ,Belanja Cindera Mata ,35100000.00,35600000.00,500000.00,1.42,"Belanja Cinderamata study banding1 lb x 600.000,00 = 600.000,00
Belanja Cindera mata Juara UPK, BPUPK, Kelmpok SPP,BKAD, terbaik I, II, III4 paket x 5.000.000,00 = 20.000.000,00
Belanja Cenderamata Juara Lomba Stand dan Kel SPP1 ls x 5.000.000,00 = 5.000.000,00
Belanja DOOR Prize /Senam Masal1 ls x 9.500.000,00 = 9.500.000,00
Belanja cinderamata study banding MP3KI1 LS x 500.000,00 = 500.000,00"
1.22 . 1.22.01 . 17.05 . 5.2.2.03 ,Belanja Jasa Kantor ,11350000.00,11950000.00,600000.00,5.29,
1.22 . 1.22.01 . 17.05 . 5.2.2.03.13 ,Belanja Dokumentasi ,2300000.00,2600000.00,300000.00,13.04,"Belanja Dokumentasi12 paket x 150.000,00 = 1.800.000,00
Belanja Publikasi dan Dokumentasi expose Jambore UPK keg PNPM5 pkt x 100.000,00 = 500.000,00
Biaya dokumentasi MP3KI2 paket x 150.000,00 = 300.000,00"
1.22 . 1.22.01 . 17.05 . 5.2.2.03.14 ,Belanja Dekorasi ,9050000.00,9350000.00,300000.00,3.31,"Belanja Dekorasi12 paket x 150.000,00 = 1.800.000,00
Belanja Dekorasi Keg Expose PNPM MPd17 ls x 150.000,00 = 2.550.000,00
Dekorasi spanduk jalan25 unit x 150.000,00 = 3.750.000,00
Dekorasi panggung1 ls x 950.000,00 = 950.000,00
Belanja Dekorasi MP3KI2 paket x 150.000,00 = 300.000,00"
1.22 . 1.22.01 . 17.05 . 5.2.2.05 ,Belanja Perawatan Kendaraan Bermotor ,0.00,5600000.00,5600000.00,0.00,
1.22 . 1.22.01 . 17.05 . 5.2.2.05.03 ,Belanja Bahan Bakar Minyak/Gas Dan Pelumas ,0.00,5600000.00,5600000.00,0.00,"Belanja BBM1 LS x 5.600.000,00 = 5.600.000,00"
1.22 . 1.22.01 . 17.05 . 5.2.2.06 ,Belanja Cetak/Penggandaan/Dokumentasi ,35867500.00,42967500.00,7100000.00,19.80,
1.22 . 1.22.01 . 17.05 . 5.2.2.06.01 ,Belanja Cetak ,4880000.00,7880000.00,3000000.00,61.48,"Belanja Cetak
Buku petunjuk Teknis125 bk x 25.000,00 = 3.125.000,00
Blangko Kop PMD8 bk x 80.000,00 = 640.000,00
Blangko SPPD8 bk x 80.000,00 = 640.000,00
Bend 2620 bk x 15.000,00 = 300.000,00
Amplop Besar kop PMD5 bk x 35.000,00 = 175.000,00
Belanja Cetak MP3KI1 LS x 3.000.000,00 = 3.000.000,00"
1.22 . 1.22.01 . 17.05 . 5.2.2.06.02 ,Belanja Penggandaan/Foto Copy ,30987500.00,35087500.00,4100000.00,13.23,"Belanja Penggandaan/Fotocopy
penggandaan laporan bimtek, bulanan, akhir tahun54 bk x 50.000,00 = 2.700.000,00
Belanja penggandaan materi peserta lokakarya125 bk x 20.000,00 = 2.500.000,00
Penggandaan materi peserta Bimtek peningk. kualitas UPK bagi BPUPK51 set x 20.000,00 = 1.020.000,00
Penggandaan materi bimtek Peningk Kapasitas BKAD51 set x 20.000,00 = 1.020.000,00
Penggandaan materi peserta Bimtek Kel SPP240 set x 20.000,00 = 4.800.000,00
Penggandaan Materi peserta Bimtek Peningk. Kapasitas Pengelolaan Keu68 set x 20.000,00 = 1.360.000,00
penggandaan materi peserta bimtek pelestarian hasil PNPM75 set x 20.000,00 = 1.500.000,00
Penggandaan Materi peserta bimtek peningk kapasitas TPK50 set x 20.000,00 = 1.000.000,00
Penggandaan materi keg. BKAD1 ls x 800.000,00 = 800.000,00
Penggandaan Materi Peserta Bimtek peningk Kapasitas Lurah75 set x 20.000,00 = 1.500.000,00
penggandaan materi penilaian kinerja UPK, TPK, Kel SPP (6 orangx 17 Kec)153 lbr x 20.000,00 = 3.060.000,00
Penggandaan Kegiatan PNPM MPd77,820 lbr x 125,00 = 9.727.500,00
Penggandaan laporan sosialisasi MP3KI3 bk x 100.000,00 = 300.000,00
Penggandaan materi peserta sosialisasi MP3KI70 set x 20.000,00 = 1.400.000,00
Fotocopi kegiatan1 LS x 2.400.000,00 = 2.400.000,00"
1.22 . 1.22.01 . 17.05 . 5.2.2.07 ,Belanja Sewa Rumah/Gedung/Gudang/Parkir ,0.00,14000000.00,14000000.00,0.00,
1.22 . 1.22.01 . 17.05 . 5.2.2.07.05 ,Belanja Sewa Kamar Hotel/Penginapan ,0.00,14000000.00,14000000.00,0.00,"Belanja Sewa kamar Hotel/Penginapan35 kamar x 400.000,00 = 14.000.000,00"
1.22 . 1.22.01 . 17.05 . 5.2.2.08 ,Belanja Sewa Sarana Mobilitas ,4100000.00,16550000.00,12450000.00,303.66,
1.22 . 1.22.01 . 17.05 . 5.2.2.08.01 ,Belanja Sewa Sarana Mobilitas Darat ,4100000.00,16550000.00,12450000.00,303.66,"Belanja Sewa Sarana Mobilitas Darat
Sewa Bus1 unit x 3.500.000,00 = 3.500.000,00
Sewa kendaraan angkut/pick up2 hr x 300.000,00 = 600.000,00
Sewa bus Studi banding MP3KI3 hari x 4.150.000,00 = 12.450.000,00"
1.22 . 1.22.01 . 17.05 . 5.2.2.10 ,Belanja Sewa Perlengkapan Dan Peralatan Kantor ,19825000.00,19825000.00,0.00,0.00,
1.22 . 1.22.01 . 17.05 . 5.2.2.10.01 ,Belanja Sewa Meja Kursi ,1625000.00,1625000.00,0.00,0.00,"Belanja Sewa Meja Kursi
Sewa Meja19 unit x 50.000,00 = 950.000,00
Sewa Kursi450 unit x 1.500,00 = 675.000,00"
1.22 . 1.22.01 . 17.05 . 5.2.2.10.04 ,Belanja Sewa Generator ,2500000.00,2500000.00,0.00,0.00,"Belanja Sewa Lampu stan dan panggung
sewa lampu stand dan panggung100 hr x 25.000,00 = 2.500.000,00"
1.22 . 1.22.01 . 17.05 . 5.2.2.10.05 ,Belanja Sewa Tenda/panggung/tikar/taman ,7700000.00,7700000.00,0.00,0.00,"Belanja Sewa Tenda30 unit x 150.000,00 = 4.500.000,00
sewa panggung160 paket x 20.000,00 = 3.200.000,00"
1.22 . 1.22.01 . 17.05 . 5.2.2.10.06 ,Belanja Sewa Pakaian Adat/Tradisional ,4000000.00,4000000.00,0.00,0.00,"Belanja sewa pakaian adat/tradisional
sewa pakaian adat/tradisional50 pkt x 80.000,00 = 4.000.000,00"
1.22 . 1.22.01 . 17.05 . 5.2.2.10.07 ,Belanja Sewa Sound System ,4000000.00,4000000.00,0.00,0.00,"Belanja Sewa Sound System
Sewa Sound system1 paket x 4.000.000,00 = 4.000.000,00"
1.22 . 1.22.01 . 17.05 . 5.2.2.11 ,Belanja Makanan Dan Minuman ,96232500.00,127732500.00,31500000.00,32.73,
1.22 . 1.22.01 . 17.05 . 5.2.2.11.02 ,Belanja Makanan Dan Minuman Rapat ,6975000.00,11250000.00,4275000.00,61.29,"Belanja Makan dan Minum Rapat
Belanja snack, minum rapat250 oh x 7.500,00 = 1.875.000,00
Belanja snack dan minum rapat koordinasi BKAD204 org x 25.000,00 = 5.100.000,00
Belanja snack dan minum rapat koordinasi MP3KI150 org x 28.500,00 = 4.275.000,00"
1.22 . 1.22.01 . 17.05 . 5.2.2.11.05 ,Belanja makanan dan minuman pelaksanaan kegiatan,89257500.00,116482500.00,27225000.00,30.50,"Belanja Makanan dan Minuman KegiatanPeserta lokakarya PNPM MPd137 ok x 125.000,00 = 17.125.000,00
peserta bimtek peningk. kualitas pengawasan UPK bagi BPUPK132 ok x 32.500,00 = 4.290.000,00
peserta bimtek peningk kapasitas BKAD132 oh x 32.500,00 = 4.290.000,00
Peserta Bimtek Kel SPP300 org x 32.500,00 = 9.750.000,00
Peserta Bimtek Peningk Kapasitas Pengelolaan keu166 oh x 32.500,00 = 5.395.000,00
Bimtek Pelestarian hasil PNPM MP182 ok x 32.500,00 = 5.915.000,00
Peserta bimtek peningk kapasitas TPK130 oh x 32.500,00 = 4.225.000,00
Peserta Bimtek Peningk Kapasitas Lurah182 oh x 32.500,00 = 5.915.000,00
Peserta tim monev kinerja perkemb. UPK153 ok x 17.500,00 = 2.677.500,00
Peserta penilaian kinerja UPK, Kel SPP., BKAD, BPUPK89 oh x 25.000,00 = 2.225.000,00
Peserta Penilaian kinerja UPK, Kel SPP, BKAD, BPUPK78 oh x 25.000,00 = 1.950.000,00
Uji petik penilaian kinerja UPK, TPK, Kel SPP, BKAD120 oh x 25.000,00 = 3.000.000,00
Peserta study banding PNPM MPd makan 2x, snack 2x58 org x 50.000,00 = 2.900.000,00
peserta study banding PNPM MPd makan1x, snack 1x58 og x 25.000,00 = 1.450.000,00
Pembukaan Jambore UPK/Expo Keg PNPM MPd350 oh x 25.000,00 = 8.750.000,00
PenutupanJambore UPK/Eskpo150 oh x 25.000,00 = 3.750.000,00
Pelaks. dan peserta ekspo keg. PNPM MPd136 oh x 25.000,00 = 3.400.000,00
Expose hasil audit keuangan PNPM MPd90 oh x 25.000,00 = 2.250.000,00
Belanja makan  prasmanan Rakor MP3KI60 oh x 45.000,00 = 2.700.000,00
Belanja makan  minum sosialisasi MP3KI81 oh x 125.000,00 = 10.125.000,00
Biaya makan minum peserta studi banding120 oh x 120.000,00 = 14.400.000,00"
1.22 . 1.22.01 . 17.05 . 5.2.2.13 ,Belanja Pakaian Kerja ,1500000.00,1500000.00,0.00,0.00,
1.22 . 1.22.01 . 17.05 . 5.2.2.13.01 ,Belanja Pakaian Kerja Lapangan ,1500000.00,1500000.00,0.00,0.00,"Belanja Pakaian Kerja Lapangan
Bel. seragam tim keg. Jambore/ekspo15 org x 100.000,00 = 1.500.000,00"
1.22 . 1.22.01 . 17.05 . 5.2.2.15 ,Belanja Perjalanan Dinas ,42770000.00,52370000.00,9600000.00,22.45,
1.22 . 1.22.01 . 17.05 . 5.2.2.15.01 ,Belanja Perjalanan Dinas Dalam Daerah ,9200000.00,720000.00,-8480000.00,-92.17,"Biaya Perjalanan Dinas
Gol III dan IV3 ok x 40.000,00 = 120.000,00
Gol IIGol II dan IV10 ok x 60.000,00 = 600.000,00"
1.22 . 1.22.01 . 17.05 . 5.2.2.15.02 ,Belanja Perjalanan Dinas Luar Daerah ,33570000.00,51650000.00,18080000.00,53.86,"Belanja Perjalanan Dinas Luar Daerah
Gol IV1 th x 21.680.000,00 = 21.680.000,00
Gol III1 th x 16.200.000,00 = 16.200.000,00
cek lokasi study banding1 ls x 1.770.000,00 = 1.770.000,00
Studi banding MP3KI
 gol III dan IV1 LS x 12.000.000,00 = 12.000.000,00"
1.22 . 1.22.01 . 17.05 . 5.2.2.20 ,Belanja Pemeliharaan ,2970000.00,4470000.00,1500000.00,50.51,
1.22 . 1.22.01 . 17.05 . 5.2.2.20.18 ,Belanja pemeliharaan alat kantor ,2970000.00,4470000.00,1500000.00,50.51,"Biaya Pemeliharaan Komputer
Servise dan suplier komputer, laptop, printer, LCD, Handycame, Tustel, werless1 ls x 4.470.000,00 = 4.470.000,00"
1.22 . 1.22.01 . 17.05 . 5.2.2.34 ,Honorarium Pelaksanaan Kegiatan ,111055000.00,134855000.00,23800000.00,21.43,
1.22 . 1.22.01 . 17.05 . 5.2.2.34.01 ,Honorarium Nara Sumber/Moderator/Tenaga Ahli ,58250000.00,61450000.00,3200000.00,5.49,"Honorarium Narasumber
Honor Tim pembina/koordinasi PNPM-MPd BKAD51 org x 600.000,00 = 30.600.000,00
Honor Penceramah Lokakarya PNPM MPd6 jpl x 200.000,00 = 1.200.000,00
Honor Penceramah Bimtek peningk. kualitas pengawas BPUPK bagi UPK12 jpl x 150.000,00 = 1.800.000,00
Honor penceramah Bimtek peningk. Kapasitas BKAD12 jpl x 150.000,00 = 1.800.000,00
Honor Penceramah Bimtek Kel SPP24 jpl x 150.000,00 = 3.600.000,00
Honor Penceramah Bimtek Peningkatan Kapasitas Keuangan12 jpl x 150.000,00 = 1.800.000,00
Honor Penceramah Bimtek Pelestarian Hasil PNPM MPd12 jpl x 150.000,00 = 1.800.000,00
Honor Penceramah Bimtek Peningk Kapasitas TPK12 jpl x 150.000,00 = 1.800.000,00
Honor Penceramah Bintek Peningkatan kapasitas Lurah12 jpl x 150.000,00 = 1.800.000,00
Honor Narasumber Pembukaan Jambore UPK dari Ditjend PMD Jakarta2 jpl x 500.000,00 = 1.000.000,00
Honor narasumber pembukaan jambore UPK4 jpl x 250.000,00 = 1.000.000,00
Honor Penceramah Lokakarya PNPM Mpd2 jpl x 200.000,00 = 400.000,00
Honor Penceramah Bintek Peningk Kualitas BPUPK Bagi UPK4 jpl x 100.000,00 = 400.000,00
Honor Penceramah Bintek Peningk Kapasitas BKAD4 jpl x 100.000,00 = 400.000,00
Honor Panitia Kel SPP8 jpl x 100.000,00 = 800.000,00
Honor Penceramah Bintek Peningk Kapasitas Pengelolaan Keu4 jpl x 100.000,00 = 400.000,00
Honor Penceramah Bintek Pelestarian Hasil PNPM-MPd4 jpl x 100.000,00 = 400.000,00
Honor Penceramah Bintek Peningk Kapasitas TPK4 jpl x 100.000,00 = 400.000,00
Honor Penceramah Bintek peningk Kapasitas Lurah4 jpl x 100.000,00 = 400.000,00
Honor Tim Monev Kinerja Perkembangan UPK51 oh x 50.000,00 = 2.550.000,00
Honor Tim penilai Kinerja UPK, BKAD, BPUPK, kel SPP12 oh x 150.000,00 = 1.800.000,00
Honor Pemandu Study Banding2 org x 200.000,00 = 400.000,00
Honor Panitia Lomba Stand dan Kel SPP2 org x 250.000,00 = 500.000,00
Honor Tim Penilai Kinerja UPK, BAKD, BPUPK Kelompok SPP8 oa x 150.000,00 = 1.200.000,00
Honor penceramah MP3KI8 jpl x 250.000,00 = 2.000.000,00
Honor moderator sosilisasi  MP3KI8 jpl x 150.000,00 = 1.200.000,00"
1.22 . 1.22.01 . 17.05 . 5.2.2.34.05 ,Honor Peserta Seminar/Simposium /Workshop/Sosialisasi,52805000.00,73405000.00,20600000.00,39.01,"Honorarium HarianHonor peserta rakor150 ok x 12.500,00 = 1.875.000,00
Honor Peserta rakor BKAD204 ok x 12.500,00 = 2.550.000,00
Honor Peserta Lokakarya PNPM125 oh x 30.000,00 = 3.750.000,00
Honor Peserta Bimtek Peningk Kualitas pengawasaan BPUPK bagi UPK102 oh x 30.000,00 = 3.060.000,00
Honor Peserta Bimtek Peningk. Kapasitas BKAD102 oa x 30.000,00 = 3.060.000,00
Honor Peserta Bimtek Kel. SPP240 oh x 30.000,00 = 7.200.000,00
Honor Peserta Bimtek Peningk. kapasitas pengel. keu136 oh x 30.000,00 = 4.080.000,00
Honor Peceramah Bimtek Pelestarian Hasil hasil PNPM MPd150 oh x 30.000,00 = 4.500.000,00
Honor Peserta Bintek peningk. kapasitas TPK100 oh x 30.000,00 = 3.000.000,00
Honor Peserta Bimtek Peningk Kapasitas Lurah150 oh x 30.000,00 = 4.500.000,00
Honor Peserta Study Banding100 org x 50.000,00 = 5.000.000,00
Honor peserta expose hasil audit PNPM MPd75 ok x 30.000,00 = 2.250.000,00
Honor peserta jaga stand Jambore UPK/Eskpo136 jpl x 30.000,00 = 4.080.000,00
Honor Tenaga bersih bersih tempat1 ls x 3.400.000,00 = 3.400.000,00
Honor Tenaga Bersh bersih Expo Keg PNPM MPd1 ls x 500.000,00 = 500.000,00
Honor peserta sosialisasi  MP3KI70 oh x 30.000,00 = 2.100.000,00
Honor peserta studi banding  MP3KI120 oh x 150.000,00 = 18.000.000,00
Honor bersih-bersih1 ls x 500.000,00 = 500.000,00"
1.22 . 1.22.01 . 17.06 ,Penyelenggaraan lomba desa ,82500000.00,102417400.00,19917400.00,24.14,"Sumber Dana :
 Lokasi Kegiatan : Kabupaten Bantul"
1.22 . 1.22.01 . 17.06 . 5.2.1 ,Belanja Pegawai ,17000000.00,41870000.00,24870000.00,146.29,
1.22 . 1.22.01 . 17.06 . 5.2.1.01 ,Honorarium PNS ,17000000.00,41870000.00,24870000.00,146.29,
1.22 . 1.22.01 . 17.06 . 5.2.1.01.01 ,Honorarium Panitia Pelaksana Kegiatan ,17000000.00,41870000.00,24870000.00,146.29,"Honorarium Panitia Pelaksana Kegiatan
Honor Tim Lomba Desa1 Bjj x 17.000.000,00 = 17.000.000,00
Honor Tim Pembinaan Kepada Desa Juara Lomba Desa1 BJJ x 24.870.000,00 = 24.870.000,00"
1.22 . 1.22.01 . 17.06 . 5.2.2 ,Belanja Barang dan Jasa ,65500000.00,60547400.00,-4952600.00,-7.56,
1.22 . 1.22.01 . 17.06 . 5.2.2.01 ,Belanja Bahan Pakai Habis ,2760000.00,2760000.00,0.00,0.00,
1.22 . 1.22.01 . 17.06 . 5.2.2.01.01 ,Belanja Alat Tulis Kantor ,2760000.00,2760000.00,0.00,0.00,"Belanja Alat Tulis Penunjang Kegaiatan
Alat Tulis penunjang kegiatan1 ls x 2.760.000,00 = 2.760.000,00"
1.22 . 1.22.01 . 17.06 . 5.2.2.02 ,Belanja Bahan/Material ,2000000.00,2000000.00,0.00,0.00,
1.22 . 1.22.01 . 17.06 . 5.2.2.02.07 ,Belanja Cindera Mata ,2000000.00,2000000.00,0.00,0.00,"Belanja Cinderamata/Tropi, Piagam
Cinderamata/Tropi/Piagam1 pkt x 2.000.000,00 = 2.000.000,00"
1.22 . 1.22.01 . 17.06 . 5.2.2.03 ,Belanja Jasa Kantor ,1750000.00,1750000.00,0.00,0.00,
1.22 . 1.22.01 . 17.06 . 5.2.2.03.13 ,Belanja Dokumentasi ,250000.00,250000.00,0.00,0.00,"Belanja Dokumentasi1 ls x 250.000,00 = 250.000,00"
1.22 . 1.22.01 . 17.06 . 5.2.2.03.14 ,Belanja Dekorasi ,1000000.00,1000000.00,0.00,0.00,"Belanja Dekorasi
 Belanja Dekorasi2 pkt x 500.000,00 = 1.000.000,00"
1.22 . 1.22.01 . 17.06 . 5.2.2.03.15 ,Belanja Publikasi ,500000.00,500000.00,0.00,0.00," Belanja Publikasi
Belanja Publikasi1 Kali x 500.000,00 = 500.000,00"
1.22 . 1.22.01 . 17.06 . 5.2.2.06 ,Belanja Cetak/Penggandaan/Dokumentasi ,5980000.00,5980000.00,0.00,0.00,
1.22 . 1.22.01 . 17.06 . 5.2.2.06.01 ,Belanja Cetak ,2000000.00,2000000.00,0.00,0.00," Belanja Cetak  Undangan500 Lbr x 4.000,00 = 2.000.000,00"
1.22 . 1.22.01 . 17.06 . 5.2.2.06.02 ,Belanja Penggandaan/Foto Copy ,3980000.00,3980000.00,0.00,0.00,"Belanja penggandaan/Fotocopy
Belanja penggandaan laporan kegiatan6 bk x 50.000,00 = 300.000,00
penggandaan juknis penilaian68 ls x 15.000,00 = 1.020.000,00
Belanja Fotocopy21,280 lbr x 125,00 = 2.660.000,00"
1.22 . 1.22.01 . 17.06 . 5.2.2.08 ,Belanja Sewa Sarana Mobilitas ,4800000.00,4800000.00,0.00,0.00,
1.22 . 1.22.01 . 17.06 . 5.2.2.08.01 ,Belanja Sewa Sarana Mobilitas Darat ,4800000.00,4800000.00,0.00,0.00,"Blj Sarana Mobilitas Darat
 > Blj Sarana Mobilitas Darat8 Lokasi x 600.000,00 = 4.800.000,00"
1.22 . 1.22.01 . 17.06 . 5.2.2.10 ,Belanja Sewa Perlengkapan Dan Peralatan Kantor ,4000000.00,4000000.00,0.00,0.00,
1.22 . 1.22.01 . 17.06 . 5.2.2.10.05 ,Belanja Sewa Tenda/panggung/tikar/taman ,4000000.00,4000000.00,0.00,0.00," Blj Sewa Tenda dll2 Pkt x 2.000.000,00 = 4.000.000,00"
1.22 . 1.22.01 . 17.06 . 5.2.2.11 ,Belanja Makanan Dan Minuman ,34510000.00,34510000.00,0.00,0.00,
1.22 . 1.22.01 . 17.06 . 5.2.2.11.02 ,Belanja Makanan Dan Minuman Rapat ,4500000.00,4500000.00,0.00,0.00,"Belanja Makanan dan Minuman Rapat 
Belanja Makan,& Minum Rapat Koordinasi300 ok x 15.000,00 = 4.500.000,00"
1.22 . 1.22.01 . 17.06 . 5.2.2.11.05 ,Belanja makanan dan minuman pelaksanaan kegiatan,30010000.00,30010000.00,0.00,0.00,"Belanja Makan minum pelaksaan kegiatan
 Blj makan, minum & snack  pembukaan Eksp100 Orang x 18.000,00 = 1.800.000,00 
Blj makan, minum & snack pembinaan100 ok x 18.000,00 = 1.800.000,00
Blj makan, minum  Peserta Ekspose425 ok x 18.000,00 = 7.650.000,00 
Blj.Makan, minum Tim Penilai & Panitia240 oh x 18.000,00 = 4.320.000,00
Blj.Snack, minum Tim Yuri & Panitia240 ok x 8.500,00 = 2.040.000,00
Blj. Makan minum dan snec dalam rangkamaju Lomdes Tk.DIY300 ok x 18.000,00 = 5.400.000,00 
Blj. Makan minum  Prasmanan200 ok x 35.000,00 = 7.000.000,00"
1.22 . 1.22.01 . 17.06 . 5.2.2.15 ,Belanja Perjalanan Dinas ,9500000.00,4547400.00,-4952600.00,-52.13,
1.22 . 1.22.01 . 17.06 . 5.2.2.15.01 ,Belanja Perjalanan Dinas Dalam Daerah ,2400000.00,0.00,-2400000.00,-100.00,Belanja perjalanan dalam daerah PNS Golongan III dan IV
1.22 . 1.22.01 . 17.06 . 5.2.2.15.02 ,Belanja Perjalanan Dinas Luar Daerah ,7100000.00,4547400.00,-2552600.00,-35.95,"Belanja Perjalanan Dinas Luar Daerah
Perjalanan Dinas Luar daerah1 Bjj x 4.547.400,00 = 4.547.400,00"
1.22 . 1.22.01 . 17.06 . 5.2.2.34 ,Honorarium Pelaksanaan Kegiatan ,200000.00,200000.00,0.00,0.00,
1.22 . 1.22.01 . 17.06 . 5.2.2.34.01 ,Honorarium Nara Sumber/Moderator/Tenaga Ahli ,200000.00,200000.00,0.00,0.00,"Honorarium Tenaga Ahli/Instruktur/narasumber
Honor Tenaga Ahli/Instruktur/Nara Sumber2 kali x 100.000,00 = 200.000,00"
1.22 . 1.22.01 . 17.07 ,Bulan bakti gotong royong masyarakat dan LKD ,55465000.00,53360000.00,-2105000.00,-3.80,"Sumber Dana : 
Lokasi Kegiatan : Kabupaten Bantul"
1.22 . 1.22.01 . 17.07 . 5.2.1 ,Belanja Pegawai ,6390000.00,6390000.00,0.00,0.00,
1.22 . 1.22.01 . 17.07 . 5.2.1.01 ,Honorarium PNS ,6390000.00,6390000.00,0.00,0.00,
1.22 . 1.22.01 . 17.07 . 5.2.1.01.01 ,Honorarium Panitia Pelaksana Kegiatan ,6390000.00,6390000.00,0.00,0.00,"Honor Panitia Pelaksana kegiatanPanitia pengarah bbgrm1 bjj x 1.000.000,00 = 1.000.000,00
Honor Sekretariat pelaksana bbgrm1 bjj x 800.000,00 = 800.000,00
Honor Tim pelaksana bbgrm1 bjj x 2.250.000,00 = 2.250.000,00
Honor Panitia Sosialisasi kelembagaan12 oh x 70.000,00 = 840.000,00
Honor Tim pelaksana LPMD1 bjj x 1.500.000,00 = 1.500.000,00
Honor panitia bimtek LKD12 org x 0,00 = 0,00
Honor Tim Verifikasi Lapangan1 BJJ x 0,00 = 0,00"
1.22 . 1.22.01 . 17.07 . 5.2.2 ,Belanja Barang dan Jasa ,49075000.00,46970000.00,-2105000.00,-4.29,
1.22 . 1.22.01 . 17.07 . 5.2.2.01 ,Belanja Bahan Pakai Habis ,2885000.00,2885000.00,0.00,0.00,
1.22 . 1.22.01 . 17.07 . 5.2.2.01.01 ,Belanja Alat Tulis Kantor ,2885000.00,2885000.00,0.00,0.00,"Belanja Alat Tulis Kantor
ATK LKD dan BBGRM1 paket x 635.000,00 = 635.000,00
ATK peserta sosialisasi kelembagaan150 ok x 15.000,00 = 2.250.000,00"
