1.22 . 1.22.01 . 15 . 04 . 5 . 2 . 2  , Belanja Barang dan Jasa  ,32450000,,
1.22 . 1.22.01 . 15 . 04 . 5 . 2 . 2 . 01  , Belanja Bahan Pakai Habis  ,1200000,,
1.22 . 1.22.01 . 15 . 04 . 5 . 2 . 2 . 01 . 01  , Belanja Alat Tulis Kantor  ,1200000," Belanja Alat Tulis Kantor Penunjang kegiatan1 tahun x 1.200.000,00 = 1.200.000,00",
1.22 . 1.22.01 . 15 . 04 . 5 . 2 . 2 . 06  , Belanja Cetak dan Penggandaan  ,12750000,,
1.22 . 1.22.01 . 15 . 04 . 5 . 2 . 2 . 06 . 01  , Belanja Cetak  ,12000000," Belanja cetak
Belanja cetak Modul Bimtek Manajemen SPAMDes1 LS x 12.000.000,00 = 12.000.000,00",
1.22 . 1.22.01 . 15 . 04 . 5 . 2 . 2 . 06 . 02  , Belanja Penggandaan  ,750000," Belanja penggandaan
Fotocopy Penunjang kegiatan5,000 lbr x 150,00 = 750.000,00",
1.22 . 1.22.01 . 15 . 04 . 5 . 2 . 2 . 11  , Belanja Makanan dan Minuman  ,10850000,,
1.22 . 1.22.01 . 15 . 04 . 5 . 2 . 2 . 11 . 02  , Belanja Makanan Dan Minuman Rapat  ,5300000," Belanja Makanan dan Minuman rapat
Makan Minum Rakor PAB100 ok x 15.000,00 = 1.500.000,00
Makan Minum Evaluasi Triwulanan120 otw x 15.000,00 = 1.800.000,00
Jamuan Monitoring ke Lokasi100 ok x 20.000,00 = 2.000.000,00",
1.22 . 1.22.01 . 15 . 04 . 5 . 2 . 2 . 11 . 05  , Belanja Makanan dan Minuman Pelaksanaan Kegiatan  ,5550000," Belanja makan minum kegiatan
Jamuan Pembentukan GAPOKPAM12 lokasi x 200.000,00 = 2.400.000,00
Jamuan Bimtek Manajemen SPAMDes180 OA x 17.500,00 = 3.150.000,00",
1.22 . 1.22.01 . 15 . 04 . 5 . 2 . 2 . 35  ," Jasa Narasumber, Tenaga Ahli, Yuri, Entry Data, Petugas Fogging dan Petugas Lapangan ",7650000,,
1.22 . 1.22.01 . 15 . 04 . 5 . 2 . 2 . 35 . 01  , Jasa Nara Sumber/Moderator/Tenaga Ahli  ,3600000," Honor narasumber
Hr Narasumber Bimtek Mnjm SPAMDes24 jpl x 150.000,00 = 3.600.000,00",
1.22 . 1.22.01 . 15 . 04 . 5 . 2 . 2 . 35 . 05  , Jasa Peserta Seminar/Simposium /Workshop/Sosialisasi  ,4050000," Honor Peserta
Honor Harian Peserta Bimtek SPAMDes150 OA x 15.000,00 = 2.250.000,00
Honor Harian Peserta Rakor Triwulanan120 OA x 15.000,00 = 1.800.000,00",
1.22 . 1.22.01 . 16  , Program pengembangan lembaga ekonomi pedesaan  ,128051500,,
1.22 . 1.22.01 . 16 . 02  , Pelatihan ketrampilan manajemen badan usaha milik desa  ,78171500," Sumber Dana : Pendapatan Asli Daerah (P A D)
 Lokasi Kegiatan : kab. Bantul",
1.22 . 1.22.01 . 16 . 02 . 5 . 2 . 1  , Belanja Pegawai  ,11920000,,
1.22 . 1.22.01 . 16 . 02 . 5 . 2 . 1 . 01  , Honorarium PNS  ,11920000,,
1.22 . 1.22.01 . 16 . 02 . 5 . 2 . 1 . 01 . 01  , Honorarium Panitia Pelaksana Kegiatan  ,11920000,"  Pendapatan Asli Daerah (P A D)
Honorarium Panitia Pelaksana Kegiatan
Honor Panitia Pelatihan Pengelolaan UP2K-PKK1 bjj x 520.000,00 = 520.000,00
Honor Tim Panitian Lomba UP2K PKK1 bjj x 1.040.000,00 = 1.040.000,00
Honor Tim Penilai Lomba UP2K PKK7 org x 400.000,00 = 2.800.000,00
Honor Panitia Bintek Pengelola UED SP1 bjj x 520.000,00 = 520.000,00
Honor Panitia Pelatihan Manajemen BUM Desa1 bjj x 520.000,00 = 520.000,00
Honor Panitia Bintek Pengelola Pedagang Pasar Desa1 bjj x 520.000,00 = 520.000,00
Honor Tim pembina1 bjj x 6.000.000,00 = 6.000.000,00",
1.22 . 1.22.01 . 16 . 02 . 5 . 2 . 2  , Belanja Barang dan Jasa  ,66251500,,
1.22 . 1.22.01 . 16 . 02 . 5 . 2 . 2 . 01  , Belanja Bahan Pakai Habis  ,7195000,,
1.22 . 1.22.01 . 16 . 02 . 5 . 2 . 2 . 01 . 01  , Belanja Alat Tulis Kantor  ,7195000," Belanja Bahan Habis Pakai
Belanja alat tulis peserta bintek pengelola pedagang pasar desa108 set x 15.000,00 = 1.620.000,00
Belanja alat tulis peserta bintek Pengelolaan UP2K PKK75 set x 15.000,00 = 1.125.000,00
Belanja alat tulis peserta sosialisasi pengembangan hutan mangrove berbasis masyarakat0 set x 15.000,00 = 0,00
Belanja alat tulis kegiatan1 ls x 2.200.000,00 = 2.200.000,00
Belanja alat tulis peserta bintek pengelola UED SP75 set x 15.000,00 = 1.125.000,00
Belanja alat tulis peserta bintek Pelatihan Manajemen BUM Desa75 set x 15.000,00 = 1.125.000,00",
1.22 . 1.22.01 . 16 . 02 . 5 . 2 . 2 . 03  , Belanja Jasa Kantor  ,1500000,,
1.22 . 1.22.01 . 16 . 02 . 5 . 2 . 2 . 03 . 14  , Belanja Dekorasi  ,300000," Belanja Dekorasi
Belanja dekorasi bintek UED SP, Pelatihan manajemen BUM desa, bintek pengelola pasar desa, pelatihan pengelolaan UP2K PKK3 paket x 100.000,00 = 300.000,00",
1.22 . 1.22.01 . 16 . 02 . 5 . 2 . 2 . 03 . 15  , Belanja Publikasi  ,1200000," Belanja publikasi3 kali x 400.000,00 = 1.200.000,00",
1.22 . 1.22.01 . 16 . 02 . 5 . 2 . 2 . 06  , Belanja Cetak dan Penggandaan  ,10180000,,
1.22 . 1.22.01 . 16 . 02 . 5 . 2 . 2 . 06 . 01  , Belanja Cetak  ,790000," Belanja Cetak
Belanja Cetak SPPD4 buku x 80.000,00 = 320.000,00
Belanja Cetak Kop PMD4 buku x 80.000,00 = 320.000,00
Belanja Cetak blangko Bend 2610 buku x 15.000,00 = 150.000,00",
1.22 . 1.22.01 . 16 . 02 . 5 . 2 . 2 . 06 . 02  , Belanja Penggandaan  ,9390000," Belanja penggandaanBelanja penggandaan materi peserta bintek UED SP75 set x 15.000,00 = 1.125.000,00
Belanja penggandaan materi peserta Pelatihan Manajemen BUMdesa75 set x 15.000,00 = 1.125.000,00
Belanja penggandaan materi peserta bintek pengelola pedagang pasar desa108 set x 15.000,00 = 1.620.000,00
Belanja penggandaan materi peserta pelatihan pengelolaan UP2K PKK75 set x 15.000,00 = 1.125.000,00
Belanja fotocopy penilaian lomba UP2K PKK3,000 lbr x 150,00 = 450.000,00
Belanja foto copy kegiatan21,300 lbr x 150,00 = 3.195.000,00
Belanja penggandaan laporan pengelola bintek UED SP, Pelat manajemen BUM desa, pengelola pasar desa, pelat Pngelolaan UP2K PKK hutan mangrove0 buku x 50.000,00 = 0,00
Belanja penggandaan materi peserta sosialisasi pengembangan hutan mangrove75 set x 10.000,00 = 750.000,00",
1.22 . 1.22.01 . 16 . 02 . 5 . 2 . 2 . 11  , Belanja Makanan dan Minuman  ,20886500,,
1.22 . 1.22.01 . 16 . 02 . 5 . 2 . 2 . 11 . 02  , Belanja Makanan Dan Minuman Rapat  ,2000000," Belanja makan minum rapat
Belanja makan dan minum rapat koordinasi100 org x 20.000,00 = 2.000.000,00",
1.22 . 1.22.01 . 16 . 02 . 5 . 2 . 2 . 11 . 05  , Belanja Makanan dan Minuman Pelaksanaan Kegiatan  ,18886500," Belanja Makanan dan minuman
Belanja snack dan minum bintek pengelola UP2K-PKK180 org x 8.500,00 = 1.530.000,00
Belanja makan dan minum bintek pengelola UP2K PKK90 org x 20.000,00 = 1.800.000,00
Belanja snack dan minum bintek Lomba lomba UP2K PKK113 org x 8.500,00 = 960.500,00
Belanja makan dan minum bintek pengelolaan BUM desa90 org x 20.000,00 = 1.800.000,00
Belanja snack dan minum bintek pengelola pedagang pasar desa246 oa x 8.500,00 = 2.091.000,00
Belanja makan dan minum bintek pengelola pedagang pasar desa123 oa x 20.000,00 = 2.460.000,00
Belanja snack dan minum bintek pengelolaan UED SP180 org x 8.500,00 = 1.530.000,00
Belanja makan dan minum bintek pengelolaan UED SP90 org x 20.000,00 = 1.800.000,00
Belanja snack dan minum bintek pengelolaan BUM desa180 org x 8.500,00 = 1.530.000,00
Belanja makan dan minum bintek Lomba lomba UP2K PKK113 org x 20.000,00 = 2.260.000,00
Belanja snack makan dan minum bintek uji petik Lomba UP2K PKK45 org x 25.000,00 = 1.125.000,00",
1.22 . 1.22.01 . 16 . 02 . 5 . 2 . 2 . 35  ," Jasa Narasumber, Tenaga Ahli, Yuri, Entry Data, Petugas Fogging dan Petugas Lapangan ",18990000,,
1.22 . 1.22.01 . 16 . 02 . 5 . 2 . 2 . 35 . 01  , Jasa Nara Sumber/Moderator/Tenaga Ahli  ,8300000," Honorarium Nara sumber
Honorarium Penc.Pengelola UED-SP8 jpl x 250.000,00 = 2.000.000,00
Hr Penceramah Pelatihan Manajemen BUMDes8 jpl x 250.000,00 = 2.000.000,00
Hr Penceramah Bintek Pengelola,Pedagang Pasar Desa8 jpl x 250.000,00 = 2.000.000,00
Hr Penceramah Pelatihan Pengelolaan UP2K-PKK8 250000 x 250.000,00 = 2.000.000,00
Hr Tenaga ahli/Instruktur3 oh x 100.000,00 = 300.000,00",
1.22 . 1.22.01 . 16 . 02 . 5 . 2 . 2 . 35 . 05  , Jasa Peserta Seminar/Simposium /Workshop/Sosialisasi  ,9990000," Honorarium Harian
Honor peserta Bintek Pengelola UED-SP menuju BUMDes75 oh x 30.000,00 = 2.250.000,00
Hr Peserta Pelatihan Manajemen BUMDes75 oh x 30.000,00 = 2.250.000,00
Hr Peserta Bintek Pengelola,Pedagang Pasar Desa108 oh x 30.000,00 = 3.240.000,00
Hr Peserta Pelatihan Pengelolaan UP2K-PKK75 oh x 30.000,00 = 2.250.000,00
Hr peserta Sosialisasi Pengembangan Hutan0 oh x 30.000,00 = 0,00",
1.22 . 1.22.01 . 16 . 02 . 5 . 2 . 2 . 35 . 06  , Jasa Tenaga Harian Lepas  ,700000," Honor Tenaga Harian Lepas
Hr peserta Sosialisasi Pengembangan Hutan28 oh x 25.000,00 = 700.000,00",
1.22 . 1.22.01 . 16 . 02 . 5 . 2 . 2 . 37  , Uang Untuk Diberikan Kepada Pihak Ketiga/Masyarakat  ,7500000,,
1.22 . 1.22.01 . 16 . 02 . 5 . 2 . 2 . 37 . 01  , Uang Untuk Diberikan Kepada Pihak Ketiga/Masyarakat  ,7500000," Belanja Uang untuk diberikan kepada masyarakat
Hadiah Lomba UP2K PKK1 LS x 7.500.000,00 = 7.500.000,00",
1.22 . 1.22.01 . 16 . 04  , Pelatihan ketrampilan usaha pertanian dan peternakan  ,28800000,"Sumber Dana : 
 Lokasi Kegiatan : kab. Bantul",
1.22 . 1.22.01 . 16 . 04 . 5 . 2 . 1  , Belanja Pegawai  ,2300000,,
1.22 . 1.22.01 . 16 . 04 . 5 . 2 . 1 . 01  , Honorarium PNS  ,2300000,,
1.22 . 1.22.01 . 16 . 04 . 5 . 2 . 1 . 01 . 01  , Honorarium Panitia Pelaksana Kegiatan  ,2300000," Honorarium Panitia Pelaksana Kegiatan
Hr.Ketua Panitia5 oa x 90.000,00 = 450.000,00
Hr Sekretaris Panitia5 oa x 90.000,00 = 450.000,00
Hr Anggota Panitia20 oa x 70.000,00 = 1.400.000,00",
1.22 . 1.22.01 . 16 . 04 . 5 . 2 . 2  , Belanja Barang dan Jasa  ,26500000,,
1.22 . 1.22.01 . 16 . 04 . 5 . 2 . 2 . 01  , Belanja Bahan Pakai Habis  ,2622500,,
1.22 . 1.22.01 . 16 . 04 . 5 . 2 . 2 . 01 . 01  , Belanja Alat Tulis Kantor  ,2622500," Belanja Alat Tulis Kantor
Belanja ATK Kegiatan Kantor1 paket x 372.500,00 = 372.500,00
Belanja Alat Tulis Peserta Pelatihan150 oa x 15.000,00 = 2.250.000,00",
1.22 . 1.22.01 . 16 . 04 . 5 . 2 . 2 . 02  , Belanja Bahan/Material  ,2500000,,
1.22 . 1.22.01 . 16 . 04 . 5 . 2 . 2 . 02 . 12  , Belanja alat-alat/perlengkapan  ,2500000," Belanja alat alat perlengkapan
Belanja Bahan dan Peralatan Pelatihan5 akt x 500.000,00 = 2.500.000,00",
1.22 . 1.22.01 . 16 . 04 . 5 . 2 . 2 . 03  , Belanja Jasa Kantor  ,300000,,
1.22 . 1.22.01 . 16 . 04 . 5 . 2 . 2 . 03 . 14  , Belanja Dekorasi  ,300000," Belanja dekorasi
Dekorasi Pelatihan Ketrampilan3 paket x 100.000,00 = 300.000,00",
1.22 . 1.22.01 . 16 . 04 . 5 . 2 . 2 . 06  , Belanja Cetak dan Penggandaan  ,1650000,,
1.22 . 1.22.01 . 16 . 04 . 5 . 2 . 2 . 06 . 01  , Belanja Cetak  ,150000," Belanja Cetak
Belanja Cetak Pelaporan pelatihan3 buku x 50.000,00 = 150.000,00",
1.22 . 1.22.01 . 16 . 04 . 5 . 2 . 2 . 06 . 02  , Belanja Penggandaan  ,1500000," Belanja penggandaan
Belanja Penggandaan/foto copy4,000 lbr x 150,00 = 600.000,00
Belanja Fotocopy Materi Peserta150 set x 6.000,00 = 900.000,00",
1.22 . 1.22.01 . 16 . 04 . 5 . 2 . 2 . 11  , Belanja Makanan dan Minuman  ,7615000,,
1.22 . 1.22.01 . 16 . 04 . 5 . 2 . 2 . 11 . 02  , Belanja Makanan Dan Minuman Rapat  ,7615000," Belanja Makanan dan Minuman
Belanja Mknan & minum rapat20 oh x 20.000,00 = 400.000,00
Belanja Snack, Mkn & minum pelatihan195 oa x 37.000,00 = 7.215.000,00",
1.22 . 1.22.01 . 16 . 04 . 5 . 2 . 2 . 35  ," Jasa Narasumber, Tenaga Ahli, Yuri, Entry Data, Petugas Fogging dan Petugas Lapangan ",11812500,,
1.22 . 1.22.01 . 16 . 04 . 5 . 2 . 2 . 35 . 01  , Jasa Nara Sumber/Moderator/Tenaga Ahli  ,8000000," Honorarium Nara sumber/tenaga ahlir. Tenag Ahli/Instruktur/Nara Sumber40 jpl x 200.000,00 = 8.000.000,00",
1.22 . 1.22.01 . 16 . 04 . 5 . 2 . 2 . 35 . 05  , Jasa Peserta Seminar/Simposium /Workshop/Sosialisasi  ,3812500," Honor Harian
Hr. Harian Peserta Pelatihan150 oa x 25.000,00 = 3.750.000,00
Hr. Harian Peserta Rapat Koordinasi Persiapan Pelatihan TTG kepada desa5 oh x 12.500,00 = 62.500,00",
1.22 . 1.22.01 . 16 . 09  , Pendayagunaan teknologi tepat guna  ,7200000,"Sumber Dana : 
 Lokasi Kegiatan : kab. Bantul",
1.22 . 1.22.01 . 16 . 09 . 5 . 2 . 2  , Belanja Barang dan Jasa  ,7200000,,
1.22 . 1.22.01 . 16 . 09 . 5 . 2 . 2 . 07  , Belanja Sewa Rumah/Gedung/Gudang/Parkir  ,7000000,,
1.22 . 1.22.01 . 16 . 09 . 5 . 2 . 2 . 07 . 02  , Belanja Sewa Gedung/Kantor/Tempat  ,7000000," Belanja Sewa Tempat
Sewa Tempat Gelar TTG Nasional1 unit x 7.000.000,00 = 7.000.000,00",
1.22 . 1.22.01 . 16 . 09 . 5 . 2 . 2 . 11  , Belanja Makanan dan Minuman  ,200000,,
1.22 . 1.22.01 . 16 . 09 . 5 . 2 . 2 . 11 . 02  , Belanja Makanan Dan Minuman Rapat  ,200000," Belanja Makanan dan Minuman
Belanja snek, Makanan & minum rapat10 oh x 20.000,00 = 200.000,00",
1.22 . 1.22.01 . 16 . 09 . 5 . 2 . 2 . 13  , Belanja Pakaian Kerja  ,0,,
1.22 . 1.22.01 . 16 . 09 . 5 . 2 . 2 . 13 . 01  , Belanja Pakaian Kerja Lapangan  ,0," Belanja pakaian kerja
Belanja seragam peserta Gelar TTG0 org x 0,00 = 0,00",
1.22 . 1.22.01 . 16 . 10  , Pengembangan SDM Posyantek  ,13880000," Sumber Dana : 
Lokasi Kegiatan : kab. Bantul",
1.22 . 1.22.01 . 16 . 10 . 5 . 2 . 1  , Belanja Pegawai  ,1320000,,
1.22 . 1.22.01 . 16 . 10 . 5 . 2 . 1 . 01  , Honorarium PNS  ,1320000,,
1.22 . 1.22.01 . 16 . 10 . 5 . 2 . 1 . 01 . 01  , Honorarium Panitia Pelaksana Kegiatan  ,1320000," HONORARIUM PNS
Hr. Panitia Sosialisasi Posyantek1 bjj x 520.000,00 = 520.000,00
Honor Tim Pemandu Study Banding4 org x 200.000,00 = 800.000,00",
1.22 . 1.22.01 . 16 . 10 . 5 . 2 . 2  , Belanja Barang dan Jasa  ,12560000,,
1.22 . 1.22.01 . 16 . 10 . 5 . 2 . 2 . 01  , Belanja Bahan Pakai Habis  ,1480000,,
1.22 . 1.22.01 . 16 . 10 . 5 . 2 . 2 . 01 . 01  , Belanja Alat Tulis Kantor  ,1480000," Belanja Bahan Habis Pakai
Belanja ATK Kegiatan Kantor1 paket x 100.000,00 = 100.000,00 
Belanja Alat Tulis Peserta Pelatihan92 pkt x 15.000,00 = 1.380.000,00",
1.22 . 1.22.01 . 16 . 10 . 5 . 2 . 2 . 03  , Belanja Jasa Kantor  ,200000,,
1.22 . 1.22.01 . 16 . 10 . 5 . 2 . 2 . 03 . 14  , Belanja Dekorasi  ,200000," Belanja Dekorasi2 pkt x 100.000,00 = 200.000,00",
1.22 . 1.22.01 . 16 . 10 . 5 . 2 . 2 . 06  , Belanja Cetak dan Penggandaan  ,1298000,,
1.22 . 1.22.01 . 16 . 10 . 5 . 2 . 2 . 06 . 01  , Belanja Cetak  ,1298000," Belanja cetak
Belanja cetak pelaporan sosialisasi3 buku x 50.000,00 = 150.000,00
Belanja Penggandaan/foto copy1,520 lbr x 150,00 = 228.000,00
Belanja Fotocopy Materi Peserta92 set x 10.000,00 = 920.000,00",
1.22 . 1.22.01 . 16 . 10 . 5 . 2 . 2 . 11  , Belanja Makanan dan Minuman  ,4722000,,
1.22 . 1.22.01 . 16 . 10 . 5 . 2 . 2 . 11 . 02  , Belanja Makanan Dan Minuman Rapat  ,4722000," Belanja Makan dan minum rapat40 oh x 20.000,00 = 800.000,00
Belanja Snack, Mkn & minum pelatihan106 org x 37.000,00 = 3.922.000,00",
1.22 . 1.22.01 . 16 . 10 . 5 . 2 . 2 . 23  , Belanja Barang Untuk Diserahkan kepada Masyarakat/Pihak Ketiga  ,400000,,
1.22 . 1.22.01 . 16 . 10 . 5 . 2 . 2 . 23 . 01  , Belanja Barang Yang Akan Diserahkan Kepada Masyarakat  ,400000," Belanja Barang yang diserahkan kepada Masyarakat
Belanja cindera mata study banding1 unit x 400.000,00 = 400.000,00",
1.22 . 1.22.01 . 16 . 10 . 5 . 2 . 2 . 35  ," Jasa Narasumber, Tenaga Ahli, Yuri, Entry Data, Petugas Fogging dan Petugas Lapangan ",4460000,,
1.22 . 1.22.01 . 16 . 10 . 5 . 2 . 2 . 35 . 01  , Jasa Nara Sumber/Moderator/Tenaga Ahli  ,1600000," Hr. Tenag Ahli/Instruktur/Nara Sumber8 jpl x 200.000,00 = 1.600.000,00",
1.22 . 1.22.01 . 16 . 10 . 5 . 2 . 2 . 35 . 05  , Jasa Peserta Seminar/Simposium /Workshop/Sosialisasi  ,2760000," HONORARIUM HARIAN
 Hr. Harian Peserta BimbinganTeknis Posyantek92 oa x 30.000,00 = 2.760.000,00",
1.22 . 1.22.01 . 16 . 10 . 5 . 2 . 2 . 35 . 06  , Jasa Tenaga Harian Lepas  ,100000," Honor Tenaga harian lepas
Honor tenaga bersih bersih1 oh x 100.000,00 = 100.000,00",
1.22 . 1.22.01 . 17  , Program peningkatan partisipasi masyarakat dalam membangun desa  ,420373000,,
1.22 . 1.22.01 . 17 . 01  , Pembinaan kelompok masyarakat pembangunan desa  ,25690000," Sumber Dana : 
 Lokasi Kegiatan : kab. Bantul",
1.22 . 1.22.01 . 17 . 01 . 5 . 2 . 1  , Belanja Pegawai  ,18000000,,
1.22 . 1.22.01 . 17 . 01 . 5 . 2 . 1 . 01  , Honorarium PNS  ,18000000,,
1.22 . 1.22.01 . 17 . 01 . 5 . 2 . 1 . 01 . 01  , Honorarium Panitia Pelaksana Kegiatan  ,18000000," Honorarium Panitia Pelaksana Kegiatan
Honor Tim Musrenbangdes1 tim x 18.000.000,00 = 18.000.000,00",
1.22 . 1.22.01 . 17 . 01 . 5 . 2 . 2  , Belanja Barang dan Jasa  ,7690000,,
1.22 . 1.22.01 . 17 . 01 . 5 . 2 . 2 . 01  , Belanja Bahan Pakai Habis  ,750000,,
1.22 . 1.22.01 . 17 . 01 . 5 . 2 . 2 . 01 . 01  , Belanja Alat Tulis Kantor  ,750000," Belanja ATK
Belanja Alat Tulis Kantor1 thn x 750.000,00 = 750.000,00",
1.22 . 1.22.01 . 17 . 01 . 5 . 2 . 2 . 03  , Belanja Jasa Kantor  ,250000,,
1.22 . 1.22.01 . 17 . 01 . 5 . 2 . 2 . 03 . 14  , Belanja Dekorasi  ,250000," Belanja Dekorasi1 pkt x 250.000,00 = 250.000,00",
1.22 . 1.22.01 . 17 . 01 . 5 . 2 . 2 . 06  , Belanja Cetak dan Penggandaan  ,690000,,
1.22 . 1.22.01 . 17 . 01 . 5 . 2 . 2 . 06 . 02  , Belanja Penggandaan  ,690000," Belanja fotocopy kegiatan4,600 lbr x 150,00 = 690.000,00",
1.22 . 1.22.01 . 17 . 01 . 5 . 2 . 2 . 11  , Belanja Makanan dan Minuman  ,4800000,,
1.22 . 1.22.01 . 17 . 01 . 5 . 2 . 2 . 11 . 02  , Belanja Makanan Dan Minuman Rapat  ,1200000," Belanja Makan & Minum80 ok x 15.000,00 = 1.200.000,00",
1.22 . 1.22.01 . 17 . 01 . 5 . 2 . 2 . 11 . 05  , Belanja Makanan dan Minuman Pelaksanaan Kegiatan  ,3600000," Belanja Makan & Minum kegiatan200 ok x 18.000,00 = 3.600.000,00",
1.22 . 1.22.01 . 17 . 01 . 5 . 2 . 2 . 35  ," Jasa Narasumber, Tenaga Ahli, Yuri, Entry Data, Petugas Fogging dan  Petugas Lapangan ",1200000,,  
1.22 . 1.22.01 . 17 . 01 . 5 . 2 . 2 . 35 . 01  , Jasa Nara Sumber/Moderator/Tenaga Ahli  ,1200000," Honor Nara Sumber dan Moderator6 ok x 200.000,00 = 1.200.000,00",
1.22 . 1.22.01 . 17 . 05  , Penunjang program nasional pemberdayaan masyarakat ( PNPM )  ,108164000,,
1.22 . 1.22.01 . 17 . 05 . 5 . 2 . 1  , Belanja Pegawai  ,33664000,"  Sumber Dana : 
Lokasi Kegiatan : 17 kecamatan dan 75 desa",
1.22 . 1.22.01 . 17 . 05 . 5 . 2 . 1 . 01  , Honorarium PNS  ,33664000,,
1.22 . 1.22.01 . 17 . 05 . 5 . 2 . 1 . 01 . 01  , Honorarium Panitia Pelaksana Kegiatan  ,33664000," Honorarium PNS
Honor Tim Pendataan Aset PNPM-MPd1 bjj x 33.664.000,00 = 33.664.000,00",
1.22 . 1.22.01 . 17 . 05 . 5 . 2 . 2  , Belanja Barang dan Jasa  ,74500000,,
1.22 . 1.22.01 . 17 . 05 . 5 . 2 . 2 . 01  , Belanja Bahan Pakai Habis  ,6750000,,
1.22 . 1.22.01 . 17 . 05 . 5 . 2 . 2 . 01 . 01  , Belanja Alat Tulis Kantor  ,6750000," Belanja ATK
Belanja Alat Tulis kegiatan1 ls x 2.750.000,00 = 2.750.000,00
Belanja ATK Peserta Tim Pendataan Aset40 set x 100.000,00 = 4.000.000,00",
1.22 . 1.22.01 . 17 . 05 . 5 . 2 . 2 . 06  , Belanja Cetak dan Penggandaan  ,6350000,,
1.22 . 1.22.01 . 17 . 05 . 5 . 2 . 2 . 06 . 01  , Belanja Cetak  ,3000000," Belanja Cetak
Belanja Cetak Pendataan Aset PNPM-MPd1 bjj x 3.000.000,00 = 3.000.000,00",
1.22 . 1.22.01 . 17 . 05 . 5 . 2 . 2 . 06 . 02  , Belanja Penggandaan  ,3350000," Belanja Penggandaan
Penggandaan laporan Pendataan Aset5 bk x 100.000,00 = 500.000,00
Belanja foto copy kegiatan19,000 lbr x 150,00 = 2.850.000,00",
1.22 . 1.22.01 . 17 . 05 . 5 . 2 . 2 . 08  , Belanja Sewa Sarana Mobilitas  ,18750000,,
1.22 . 1.22.01 . 17 . 05 . 5 . 2 . 2 . 08 . 01  , Belanja Sewa Sarana Mobilitas Darat  ,18750000," Belanja sewa Sarana Mobilitas Darat
Belanja sewa bus75 unit x 250.000,00 = 18.750.000,00",
1.22 . 1.22.01 . 17 . 05 . 5 . 2 . 2 . 11  , Belanja Makanan dan Minuman  ,39900000,,
1.22 . 1.22.01 . 17 . 05 . 5 . 2 . 2 . 11 . 02  , Belanja Makanan Dan Minuman Rapat  ,11400000," Belanja Makanan dan minuman
Belanja Makan, Snek dan minum Rapat Koordinasi400 org x 28.500,00 = 11.400.000,00",
1.22 . 1.22.01 . 17 . 05 . 5 . 2 . 2 . 11 . 05  , Belanja Makanan dan Minuman Pelaksanaan Kegiatan  ,28500000," Belanja makan snek dan minum kegiatan1,000 org x 28.500,00 = 28.500.000,00",
1.22 . 1.22.01 . 17 . 05 . 5 . 2 . 2 . 35  ," Jasa Narasumber, Tenaga Ahli, Yuri, Entry Data, Petugas Fogging dan Petugas Lapangan ",2750000,,
1.22 . 1.22.01 . 17 . 05 . 5 . 2 . 2 . 35 . 05  , Jasa Peserta Seminar/Simposium /Workshop/Sosialisasi  ,2750000," Honorarium Rapat Koordinasi220 org x 12.500,00 = 2.750.000,00",
1.22 . 1.22.01 . 17 . 06  , Penyelenggaraan lomba desa  ,78214000," Sumber Dana : 
Lokasi Kegiatan : kab. Bantul",
1.22 . 1.22.01 . 17 . 06 . 5 . 2 . 1  , Belanja Pegawai  ,37000000,,
1.22 . 1.22.01 . 17 . 06 . 5 . 2 . 1 . 01  , Honorarium PNS  ,37000000,,
1.22 . 1.22.01 . 17 . 06 . 5 . 2 . 1 . 01 . 01  , Honorarium Panitia Pelaksana Kegiatan  ,37000000," Honor panitia pelaksana kegiatan
Honor Tim Lomba Desa1 BJJ x 19.000.000,00 = 19.000.000,00
Honor Tim verifikasi Lomba Desa1 BJJ x 18.000.000,00 = 18.000.000,00",
1.22 . 1.22.01 . 17 . 06 . 5 . 2 . 2  , Belanja Barang dan Jasa  ,41214000,,
1.22 . 1.22.01 . 17 . 06 . 5 . 2 . 2 . 01  , Belanja Bahan Pakai Habis  ,5300000,,
1.22 . 1.22.01 . 17 . 06 . 5 . 2 . 2 . 01 . 01  , Belanja Alat Tulis Kantor  ,5300000," Belanja ATK
Blj Alat Tulis Penunjang Kegiatan1 thn x 800.000,00 = 800.000,00
Blj Alat Tulis ( Tas,Blok Not.Polpoin ) Tim verifikasi60 paket x 75.000,00 = 4.500.000,00",
1.22 . 1.22.01 . 17 . 06 . 5 . 2 . 2 . 02  , Belanja Bahan/Material  ,2000000,,
1.22 . 1.22.01 . 17 . 06 . 5 . 2 . 2 . 02 . 07  , Belanja Cindera Mata  ,2000000," Belanja cinderamata
 Belanja Cendera mata Tropy1 paket x 2.000.000,00 = 2.000.000,00",
1.22 . 1.22.01 . 17 . 06 . 5 . 2 . 2 . 03  , Belanja Jasa Kantor  ,700000,,
1.22 . 1.22.01 . 17 . 06 . 5 . 2 . 2 . 03 . 14  , Belanja Dekorasi  ,300000," Belanja dekorasi2 paket x 150.000,00 = 300.000,00",
1.22 . 1.22.01 . 17 . 06 . 5 . 2 . 2 . 03 . 15  , Belanja Publikasi  ,400000," Belanja publikasi1 kali x 400.000,00 = 400.000,00",
1.22 . 1.22.01 . 17 . 06 . 5 . 2 . 2 . 06  , Belanja Cetak dan Penggandaan  ,2024000,,
1.22 . 1.22.01 . 17 . 06 . 5 . 2 . 2 . 06 . 02  , Belanja Penggandaan  ,2024000," Belanja penggandaan
Belanja penggandaan laporan kegiatan7 buku x 40.000,00 = 280.000,00 
Belanja penggandaan juknis penilaian68 pkt x 8.000,00 = 544.000,00 
Belanja Fotocopy8,000 lbr x 150,00 = 1.200.000,00",
1.22 . 1.22.01 . 17 . 06 . 5 . 2 . 2 . 08  , Belanja Sewa Sarana Mobilitas  ,4000000,,
1.22 . 1.22.01 . 17 . 06 . 5 . 2 . 2 . 08 . 01  , Belanja Sewa Sarana Mobilitas Darat  ,4000000," Belanja sewa Sarana Mobilitas Darat8 kali x 500.000,00 = 4.000.000,00",
1.22 . 1.22.01 . 17 . 06 . 5 . 2 . 2 . 11  , Belanja Makanan dan Minuman  ,19590000,,
1.22 . 1.22.01 . 17 . 06 . 5 . 2 . 2 . 11 . 02  , Belanja Makanan Dan Minuman Rapat  ,3000000," Belanja makan minum rapat 
Belanja Makan,& Minum Rapat Koordinasi200 ok x 15.000,00 = 3.000.000,00",
1.22 . 1.22.01 . 17 . 06 . 5 . 2 . 2 . 11 . 05  , Belanja Makanan dan Minuman Pelaksanaan Kegiatan  ,16590000," Belanja makan minum kegiatan
Blj makan, minum & snek pembukaan Eksp130 org x 18.000,00 = 2.340.000,00
Blj makan, minum Peserta Ekspose425 ok x 15.000,00 = 6.375.000,00
Blj.Makan, minum Tim Penilai & Panitia105 oh x 18.000,00 = 1.890.000,00
Blj.Snack, minum Tim Yuri & Panitia210 ok x 8.500,00 = 1.785.000,00
Blj.Makan Minum Verifikasi280 ok x 15.000,00 = 4.200.000,00",
1.22 . 1.22.01 . 17 . 06 . 5 . 2 . 2 . 14  , Belanja Pakaian khusus dan hari-hari tertentu  ,6000000,,
1.22 . 1.22.01 . 17 . 06 . 5 . 2 . 2 . 14 . 03  , Belanja Pakaian Batik Tradisional  ,6000000,"  Belanja Pakaian Batik Tradisional60 ptg x 100.000,00 = 6.000.000,00",
1.22 . 1.22.01 . 17 . 06 . 5 . 2 . 2 . 35  ," Jasa Narasumber, Tenaga Ahli, Yuri, Entry Data, Petugas Fogging dan Petugas Lapangan ",1600000,,
1.22 . 1.22.01 . 17 . 06 . 5 . 2 . 2 . 35 . 01  , Jasa Nara Sumber/Moderator/Tenaga Ahli  ,100000," Honor narasumber
Honor narasumber publikasi1 kali x 100.000,00 = 100.000,00",
1.22 . 1.22.01 . 17 . 06 . 5 . 2 . 2 . 35 . 06  , Jasa Tenaga Harian Lepas  ,1500000," Honor tenaga bersih-bersih6 ok x 250.000,00 = 1.500.000,00",
1.22 . 1.22.01 . 17 . 07  , Bulan bakti gotong royong masyarakat dan LKD  ,38015000,"Sumber Dana : 
 Lokasi Kegiatan : kab. Bantul",
1.22 . 1.22.01 . 17 . 07 . 5 . 2 . 1  , Belanja Pegawai  ,7500000,,
1.22 . 1.22.01 . 17 . 07 . 5 . 2 . 1 . 01  , Honorarium PNS  ,7500000,,
1.22 . 1.22.01 . 17 . 07 . 5 . 2 . 1 . 01 . 01  , Honorarium Panitia Pelaksana Kegiatan  ,7500000," Honor Panitia Pelaksana kegiatan
Honor Tim Pelaksana BBGRM1 BJJ x 6.500.000,00 = 6.500.000,00
Honor Pemandu studi banding5 org x 200.000,00 = 1.000.000,00",
1.22 . 1.22.01 . 17 . 07 . 5 . 2 . 2  , Belanja Barang dan Jasa  ,30515000,,
1.22 . 1.22.01 . 17 . 07 . 5 . 2 . 2 . 01  , Belanja Bahan Pakai Habis  ,500000,,
1.22 . 1.22.01 . 17 . 07 . 5 . 2 . 2 . 01 . 01  , Belanja Alat Tulis Kantor  ,500000," Belanja alat tulis kantor
Belanja ATK LKD dan BBGRM1 paket x 500.000,00 = 500.000,00",
1.22 . 1.22.01 . 17 . 07 . 5 . 2 . 2 . 02  , Belanja Bahan/Material  ,1000000,,
1.22 . 1.22.01 . 17 . 07 . 5 . 2 . 2 . 02 . 07  , Belanja Cindera Mata  ,1000000," Belanja cinderamata
Belanja cinderamata studi banding1 paket x 1.000.000,00 = 1.000.000,00",
1.22 . 1.22.01 . 17 . 07 . 5 . 2 . 2 . 03  , Belanja Jasa Kantor  ,3240000,,
1.22 . 1.22.01 . 17 . 07 . 5 . 2 . 2 . 03 . 14  , Belanja Dekorasi  ,3240000," Belanja dekorasi2 kali x 120.000,00 = 240.000,00
Belanja dekorasi pencanangan dan penutupan BBGRM1 BJJ x 3.000.000,00 = 3.000.000,00",
1.22 . 1.22.01 . 17 . 07 . 5 . 2 . 2 . 06  , Belanja Cetak dan Penggandaan  ,1050000,,
1.22 . 1.22.01 . 17 . 07 . 5 . 2 . 2 . 06 . 01  , Belanja Cetak  ,550000," Belanja cetak1 LS x 550.000,00 = 550.000,00",
1.22 . 1.22.01 . 17 . 07 . 5 . 2 . 2 . 06 . 02  , Belanja Penggandaan  ,500000," Belanja penggandaan
Belanja fotocopi kegiatan BBGRM dan LKD1 paket x 500.000,00 = 500.000,00",
1.22 . 1.22.01 . 17 . 07 . 5 . 2 . 2 . 10  , Belanja Sewa Perlengkapan dan Peralatan Kantor  ,3000000,,
1.22 . 1.22.01 . 17 . 07 . 5 . 2 . 2 . 10 . 05  , Belanja Sewa Tenda  ,3000000," Belanja sewa tenda
Belanja sewa tenda, kursi, meja dalam rangka pencanangan dan penutupan BBGRM1 BJJ x 3.000.000,00 = 3.000.000,00",
1.22 . 1.22.01 . 17 . 07 . 5 . 2 . 2 . 11  , Belanja Makanan dan Minuman  ,17725000,,
