1.25 . 1.20.03 . 18 . 01 . 5 . 2 . 2 . 11 . 01,Belanja Makanan Dan Minuman Harian Pegawai,2200000,"Pendapatan Asli Daerah (P A D) 
Belanja minum piket BE
Biaya minum sekertariat BE11 hr x 200.000,00 = 2.200.000,00"
1.25 . 1.20.03 . 18 . 01 . 5 . 2 . 2 . 11 . 02,Belanja Makanan Dan Minuman Rapat,4970000,"Pendapatan Asli Daerah (P A D)
 Belanja makan minum rapat
Biaya makan minum rakor BE200 org/kl x 8.500,00 = 1.700.000,00
Biaya makan minum pembubaran panitia BE70 org/kl x 28.500,00 = 1.995.000,00
Biaya makan minum rapat siaran taman gabusan150 org/kl x 8.500,00 = 1.275.000,00"
1.25 . 1.20.03 . 18 . 01 . 5 . 2 . 2 . 11 . 03,Belanja Makanan Dan Minuman Tamu,10875000,"Pendapatan Asli Daerah (P A D)
 Belanja makan minum tamu
Biaya makan minu tamu pembukaan dan penutupan BE1,000 Org x 10.000,00 = 10.000.000,00
Biaya makan minum tamu peresmian BE 201625 Org x 35.000,00 = 875.000,00"
1.25 . 1.20.03 . 18 . 01 . 5 . 2 . 2 . 11 . 05,Belanja Makanan dan Minuman Pelaksanaan Kegiatan,5700000,"Pendapatan Asli Daerah (P A D) 
Belanja makan minum pelaksana kegiatan
biaya mamin keg peliputan dinamika Pemb200 org/kl x 8.500,00 = 1.700.000,00
biaya mamin jumpa pers200 org/kl x 20.000,00 = 4.000.000,00"
1.25 . 1.20.03 . 18 . 01 . 5 . 2 . 2 . 13,Belanja Pakaian Kerja,15000000,
1.25 . 1.20.03 . 18 . 01 . 5 . 2 . 2 . 13 . 01,Belanja Pakaian Kerja Lapangan,15000000,"Pendapatan Asli Daerah (P A D) 
Belanja pakain kerjabiaya seragam BE100 Bh x 150.000,00 = 15.000.000,00"
1.25 . 1.20.03 . 18 . 01 . 5 . 2 . 2 . 15,Belanja Perjalanan Dinas,64630000,
1.25 . 1.20.03 . 18 . 01 . 5 . 2 . 2 . 15 . 01,Belanja Perjalanan Dinas Dalam Daerah,4630000,"Pendapatan Asli Daerah (P A D) 
Belanja perjalan dinas dalam daerah
Gol III88 OK x 40.000,00 = 3.520.000,00
Gol II37 OK x 30.000,00 = 1.110.000,00"
1.25 . 1.20.03 . 18 . 01 . 5 . 2 . 2 . 15 . 02,Belanja Perjalanan Dinas Luar Daerah,60000000,"Pendapatan Asli Daerah (P A D) 
biaya perjlanan dinas luar daerah
gol IV10 OH x 1.750.000,00 = 17.500.000,00
GOL III10 OH x 1.550.000,00 = 15.500.000,00
Tiket Pesawat10 oh x 2.100.000,00 = 21.000.000,00
Tiket KA10 Tiket x 600.000,00 = 6.000.000,00"
1.25 . 1.20.03 . 18 . 01 . 5 . 2 . 2 . 23,Belanja Barang Untuk Diserahkan kepada Masyarakat/Pihak Ketiga,22250000,
1.25 . 1.20.03 . 18 . 01 . 5 . 2 . 2 . 23 . 01,Belanja Barang Yang Akan Diserahkan Kepada Masyarakat,22250000,"Pendapatan Asli Daerah (P A D)
 Belanja barang yang akn diserahkan kpd masyarakat
Belanja 1 ekor sapi hadiah juara I lomba stand BE1 EKOR x 12.500.000,00 = 12.500.000,00
Belanja 3 ekor kambing hadiah juara II lomba stand BE3 ekor x 1.500.000,00 = 4.500.000,00
Belanja 2 ekor kambing hadiah juara III lomba stand BE2 ekor x 1.500.000,00 = 3.000.000,00
Belanja Tropy juara 1,2,dan 3 untuk stand kecamatan3 bh x 250.000,00 = 750.000,00
Belanja Tropy juara 1,2,dan 3 untuk stand Dinas3 bh x 250.000,00 = 750.000,00
Belanja Tropy juara 1,2,dan 3 untuk stand umum3 bh x 250.000,00 = 750.000,00"
1.25 . 1.20.03 . 18 . 01 . 5 . 2 . 2 . 35,"Jasa Narasumber, Tenaga Ahli, Yuri, Entry Data, Petugas Fogging dan Petugas Lapangan",65635000,
1.25 . 1.20.03 . 18 . 01 . 5 . 2 . 2 . 35 . 01,Jasa Nara Sumber/Moderator/Tenaga Ahli,6400000,"Pendapatan Asli Daerah (P A D) 
HR Jasa Nara Sumber
Hr nara sumber jumpa pers32 org/kl x 200.000,00 = 6.400.000,00"
1.25 . 1.20.03 . 18 . 01 . 5 . 2 . 2 . 35 . 02,Jasa Yuri Perlombaan/Pelatih,900000,"Pendapatan Asli Daerah (P A D) 
Hr Tim Yuri lomba pameran BE3 Org x 300.000,00 = 900.000,00"
1.25 . 1.20.03 . 18 . 01 . 5 . 2 . 2 . 35 . 09,Jasa Petugas Lapangan,58335000,"Pendapatan Asli Daerah (P A D) 
Hr Petugas LapanganHr Petugas keamanan BE960 org/Hr x 40.000,00 = 38.400.000,00
Hr Petugas piket BE260 org/hr x 30.000,00 = 7.800.000,00
Hr petugas P3K BE66 org/hr x 30.000,00 = 1.980.000,00
HR Pemandu acr kesenian BE66 org/hr x 30.000,00 = 1.980.000,00
Hr Petugas kebersihan BE108 org/hr x 25.000,00 = 2.700.000,00
Hr Petugas menara siar BE99 org/hr x 25.000,00 = 2.475.000,00
Hr Penari Pembukaan BE6 org x 300.000,00 = 1.800.000,00
hr petugas acara pembukaan dan penutupan BE8 ORG x 150.000,00 = 1.200.000,00"
1.06 . 1.20.03 . 21,Program perencanaan pembangunan daerah,800000,
1.06 . 1.20.03 . 21 . 36,Penyusunan RPJMD,800000,"Sumber Dana : Pendapatan Asli Daerah (P A D)
Lokasi Kegiatan : Bantul
Keluaran : pembuatan rencana kegiatan
Target  : 100 %"
1.06 . 1.20.03 . 21 . 36 . 5 . 2 . 2,Belanja Barang dan Jasa,800000,
1.06 . 1.20.03 . 21 . 36 . 5 . 2 . 2 . 01,Belanja Bahan Pakai Habis,300000,
1.06 . 1.20.03 . 21 . 36 . 5 . 2 . 2 . 01 . 01,Belanja Alat Tulis Kantor,300000,"Pendapatan Asli Daerah (P A D) 
Belanja ATK Keg. Penyusunan Renja1 ls x 300.000,00 = 300.000,00"
1.06 . 1.20.03 . 21 . 36 . 5 . 2 . 2 . 06,Belanja Cetak dan Penggandaan,150000,
1.06 . 1.20.03 . 21 . 36 . 5 . 2 . 2 . 06 . 02,Belanja Penggandaan,150000,"Pendapatan Asli Daerah (P A D) 
Belanja Penggandaan Penyusunan Renja
Belanja Pengandaan1,000 lmbr x 150,00 = 150.000,00"
1.06 . 1.20.03 . 21 . 36 . 5 . 2 . 2 . 11,Belanja Makanan dan Minuman,350000,
1.06 . 1.20.03 . 21 . 36 . 5 . 2 . 2 . 11 . 02,Belanja Makanan Dan Minuman Rapat,350000,"Pendapatan Asli Daerah (P A D) 
Belanja makan & minum Rapat20 org x 17.500,00 = 350.000,00"
,,,
,SURPLUS / (DEFISIT),2167334492,
