2.01.2.02.01.19.02.5.2.3.21.001. ,Belanja modal pengadaan konstruksi jalan ,1200000000, Pembangunan jalan lingkar UPTD (DAK Tan) 200000000.00 JPP Tembakau. Dsn Lemah Bang. Ds Kr Ngasem. Paliyan(pemanfaatan sisa dana 200000000.00 DAK Tan Tahun 2011-2013) JPP Mete KT Ngudi Luhur. Karangpilang Kidul. Rejosari. Semin (pemanfaatan sisa 150000000.00 dana DAK Tan Tahun 2011-2013) JPP Mete. KT SAE. Kalialang. Kalitekuk. Semin (pemanfaatan sisa dana DAK Tan 200000000.00 Tahun 2011-2013) JPP Kakao. KT Baran Rejo. Baran. Salam. Patuk (pemanfaatan sisa dana DAK Tan 150000000.00 Tahun 2011-2013) JPP Kakao. KT Sedyo Dadi. Karang. Ngalang. Gedangsari (pemanfaatan sisa dana 150000000.00 DAK Tan Tahun 2011-2013) JPP Tebu. KT Margo Manis. Sawahan I. Bleberan. Playen (pemanfaatan sisa dana 150000000.00 DAK Tan Tahun 2011-2013),,,
2.01.2.02.01.19.02.5.2.3.23. ,Belanja Modal Pengadaan Konstruksi Jaringan Air ,200000000,,,,
2.01.2.02.01.19.02.5.2.3.23.005. ,Belanja modal pengadaan konstruksi jaringan irigasi ,200000000, Pembangunan talud 200000000.00,,,
2.01.2.02.01.19.02.5.2.3.26. ,Belanja Modal Pengadaan Konstruksi/Pembelian ,750000000, Bangunan,,,
2.01.2.02.01.19.02.5.2.3.26.001. ,Belanja modal pengadaan konstruksi/pembelian ,700000000, bangunan gedung kantor Pembangunan ruang pertemuan UPTD (DAK Tan) 300000000.00 Pembangunan rumah media UPTD (DAK Tan) 200000000.00 Pembangunan bedeng sapih (DAK Tan) 200000000.00,,,
2.01.2.02.01.19.02.5.2.3.26.009. ,Belanaja Modal sumur bor ,50000000, Pembangunan sumur (DAK Tan) 50000000.00,,,
2.01.2.02.01.19.02.5.2.3.32. ,Belanja Modal Pengadaan Perlengkapan dan ,250000000, Peralatan Pertanian,,,
2.01.2.02.01.19.02.5.2.3.32.001. ,Belanja modal peralatan pertanian ,60000000, Pengadaan alat penggiling media (DAK Tan) 60000000.00,,,
2.01.2.02.01.19.02.5.2.3.32.004. ,Belanja modal pengadaan penampungan air ,190000000, Pembangunan bak penampung air 190000000.00,,,
2.01.2.02.01.19.02.5.2.3.33. ,Belanja Modal Pengadaan Perlengkapan Gedung ,200000000, Kantor,,,
2.01.2.02.01.19.02.5.2.3.33.002. ,Belanja Modal Pagar ,200000000, Pembangunan pagar UPTD (DAK Tan) 200000000.00,,,
2.01.2.02.01.19.03. ,PENGEMBANGAN BIBIT UNGGUL ,74850000,Lokasi Kegiatan: Kab Gunungkidul PERTANIAN/PERKEBUNAN Sumber Dana: DAU.,,,
2.01.2.02.01.19.03.5.2.1. ,BELANJA PEGAWAI ,47400000,,,,
2.01.2.02.01.19.03.5.2.1.01. ,Honorarium PNS ,500000,,,,
2.01.2.02.01.19.03.5.2.1.01.002. ,Honorarium Panitia Pengadaan Barang dan Jasa ,500000, Honorarium pejabat pengadaan 250000.00 Honorarium Pejabat Penerima 250000.00,,,
2.01.2.02.01.19.03.5.2.1.02. ,Honorarium Non PNS ,46900000,,,,
2.01.2.02.01.19.03.5.2.1.02.004. ,Upah/ongkos tenaga ,46900000,46900000 Upah harian tenaga lepas (untuk pengembangan bibit unggul) 46900000.00 Tenaga pengawas (1 org x 360 hari) 12600000.00 Pengolahan Media tanah 3500000.00 Pembersihan Lokasi 700000.00 Pembuatan Bedeng dan Persemaian 1400000.00 Pengisian Polybag 5250000.00 Penanaman bibit ke polybag 3500000.00 Penyiangan 2100000.00 Penyulaman 1050000.00 Penggeseran polybag 6300000.00 Pemeliharaan (penyiraman) 10500000.00,,,
2.01.2.02.01.19.03.5.2.2. ,BELANJA BARANG DAN JASA ,27450000,,,,
2.01.2.02.01.19.03.5.2.2.02. ,Belanja Bahan/Material ,27450000,,,,
2.01.2.02.01.19.03.5.2.2.02.002. ,Belanja bahan/bibit tanaman ,27450000,27450000 Pembuatan persemaian bibit jati 16650000.00 Polybag 2800000.00 Benih 7500000.00 Pupuk tanah 3750000.00 Tanah 2600000.00 Pembuatan Persemaian Sengon Laut 10800000.00 Polybag 2400000.00 Benih 3200000.00 Pupuk Organik 3000000.00 Tanah 2200000.00,,,
,JUMLAH BELANJA,955961621259,,,,
,SURPLUS/(DEFISIT) ,953461621259,,,,
