"Judul","Anggaran Pendapatan Belanja Desa (APBDesa) sesuai Peraturan Desa (Perdes) Desa Girisuko Nomor 7 Tahun 2015",,
"Daerah","Desa Girisuko",,
"Tahun",2016,,
"Kode Organisasi",1000,,
"Nama Organisasi","Pemerintah Desa Girisuko",,
"Kolom",4,,
,,,
"Kode Rekening","Uraian","Jumlah","Keterangan"
1,"PENDAPATAN DESA",1582242770,
"1.1","Pendapatan Asli Desa (PADesa)",19110000,
"1.1.1","Hasil Usaha",,
"1.1.2","Hasil Pengelolaan Aset Desa",1910000,
"1.1.2.1","Pengelolaan Tanah Milik Desa",700000,
"1.1.2.3.3","Hasil Menyewakan Kios Desa",710000,
"1.1.2.8","Lain-Lain Kekayaan Milik Desa",1200000,
"1.1.3","Swadaya Partisipasi dan Gotong Royong",,
"1.1.4","Lain-Lain PADesa yang Sah",17200000,
"1.1.4.1","Pungutan Desa",15000000,
"1.1.4.2","Pendapatan Bunga",2200000,
"1.2","Pendapatan Transfer",1563132770,
"1.2.1","Dana Desa (DD) dari Anggaran Pendapatan dan Belanja Negara (APBN)",768673800,
"1.2.2.1.1","Bagian Hasil Pajak Daerah",21407200,
"1.2.2.2.1","Bagian Hasil Retribusi Daerah",23768170,
"1.2.3","Alokasi Dana Desa (ADD)",749283600,
2,"BELANJA DESA",1571132770,
"2.1","Bidang Penyelenggaraan Pemerintahan Desa",720063300,
"2.1.1","Program Operasional Kantor Desa",46714000,
"2.1.1.2","Biaya Jasa Komunikasi Sumber Daya Air dan Listrik",5220000,"Alokasi Dana Desa/ADD"
"2.1.1.3","Pemeliharaan dan Perijinan Kendaraan Dinas/Operasional",2700000,"Alokasi Dana Desa/ADD"
"2.1.1.4","Penyediaan Barang Cetakan dan Penggandaan",2160000,"Alokasi Dana Desa/ADD"
"2.1.1.5","Penyediaan Alat Tulis Kantor",6734000,"Alokasi Dana Desa/ADD"
"2.1.1.6","Penyediaan Jasa Kebersihan Kantor",6000000,"Alokasi Dana Desa/ADD"
"2.1.1.8","Penyediaan Komponen Instalasi Listrik/Penerangan Bangunan Kantor",500000,
"2.1.1.9","Rapat Koordinasi dan Konsultasi ke Luar Daerah",4900000,"Alokasi Dana Desa/ADD"
"2.1.1.10","Makan dan Minum Rapat Koordinasi",18500000,"Alokasi Dana Desa/ADD"
"2.1.2","Program Sarana dan Prasarana Aparatur",170627000,
"2.1.2.1","Penyediaan Jasa Perbaikan Peralatan Kerja",2500000,"Alokasi Dana Desa/ADD"
"2.1.2.3","Penyediaan Jasa Perbaikan Peralatan dan Perlengkapan Kantor",1000000,"Alokasi Dana Desa/ADD"
"2.1.2.4","Penyediaan Peralatan Rumah Tangga",4500000,"Alokasi Dana Desa/ADD"
"2.1.2.5","Pembangunan Gedung Kantor Desa",134512000,"Alokasi Dana Desa/ADD"
"2.1.2.8","Pengadaan Peralatan Kerja",11840000,"Alokasi Dana Desa/ADD"
"2.1.2.18","Rehabilitasi Sedang/Berat Balai Desa",16275000,"Alokasi Dana Desa/ADD"
"2.1.3","Program Peningkatan Kinerja Aparatur Pemerintahan Desa",355111000,
"2.1.3.1","Penghasilan Tetap dan Tunjangan Kepala Desa dan Perangkat Desa",284856000,"Alokasi Dana Desa/ADD"
"2.1.3.2","Tunjangan dan Operasional Badan Permusyawaratan Desa (BPD)",21975000,"Alokasi Dana Desa/ADD"
"2.1.3.3","Operasional Rukun Tetangga (RT)/Rukun Warga (RW)",27500000,"Alokasi Dana Desa/ADD"
"2.1.3.4","Operasional Pembinaan Kesejahteraan Keluarga (PKK)",4500000,"Alokasi Dana Desa/ADD"
"2.1.3.5","Operasional Lembaga Pemberdayaan Masyarakat Desa/LPMD",4680000,"Alokasi Dana Desa/ADD"
"2.1.3.6","Operasional Karang Taruna",3600000,"Alokasi Dana Desa/ADD"
"2.1.3.7","Pengadaan Seragam/Pakaian Dinas",5000000,"Alokasi Dana Desa/ADD"
"2.1.3.9","Penyediaan Bahan Bacaan dan Peraturan Perundang-undangan",3000000,"Alokasi Dana Desa/ADD"
"2.1.4","Program Perencanaan Pembangunan Desa",60331300,
"2.1.4.1","Penyusunan Monografi Desa",2240000,"Alokasi Dana Desa/ADD"
"2.1.4.2","Penyusunan Profil Desa",3726300,"Dana Desa/DD"
"2.1.4.4","Pengelolaan Sistem Informasi Desa (SID)",27805000,"Alokasi Dana Desa/ADD"
"2.1.4.6","Penyusunan Rancangan Peraturan Desa tentang Rencana Kerja Pemerintah Desa (RKPDesa)",3847500,"Alokasi Dana Desa/ADD"
"2.1.4.10","Penyelenggaraan Musyawarah Desa",9470000,"Alokasi Dana Desa/ADD"
"2.1.4.11","Penyelenggaraan Musrenbang Desa",13242500,"Alokasi Dana Desa/ADD"
"2.1.5","Program Pengelolaan Keuangan dan Kekayaan/Aset Daerah",53855000,
"2.1.5.1","Penyusunan Rancangan Peraturan Desa tentang APBDesa",2940000,"Alokasi Dana Desa/ADD"
"2.1.5.2","Penyusunan Rancangan Peraturan Desa tentang Perubahan APBDesa",2940000,"Alokasi Dana Desa/ADD"
"2.1.5.3","Penyusunan Laporan Keuangan Bulanan/SPJ dan Semesteran",16260000,"Alokasi Dana Desa/ADD"
"2.1.5.4","Penyusunan Rancangan Peraturan Desa Tentang Pertanggungjawaban",2940000,"Alokasi Dana Desa/ADD"
"2.1.5.5","Inventarisasi Kekayaan atau Aset Desa (Tanah Kas Desa)",6525000,"Alokasi Dana Desa/ADD"
"2.1.5.8","Intensifikasi Pemungutan Pajak Daerah/Pajak Bumi Bangunan",18750000,"Pengembalian Retribusi dan Pajak"
"2.1.5.11","Sertifikasi Tanah Milik Desa",3500000,"Pendapatan Asli Desa/PADesa"
"2.1.6","Program Optimalisasi Peran dan Akuntabilitas Kelembagaan",28425000,
"2.1.6.6","Peningkatan Pelayanan Satu Pintu/Terpadu",11250000,"Alokasi Dana Desa/ADD"
"2.1.6.9","Fasilitasi Sertifikasi Tanah Milik Masyarakat secara Massal",14150000,"Dana Desa/DD"
"2.1.6.11","Penyusunan Laporan Penyelenggaraan Pemerintahan Desa (LPPD)",3025000,"Alokasi Dana Desa/ADD"
"2.1.7","Program Kearsipan Desa",5000000,
"2.1.7.3","Penduplikatan Dokumen/Arsip Desa dalam bentuk Informatika",5000000,"Pengembalian Retribusi dan Pajak"
"2.2","Bidang Pembangunan Desa",530180370,
"2.2.1","Program Pengembangan PAUD",30800000,
"2.2.1.4","Insentif Pendidik dan Dukungan Penyelenggaraan PAUD",30800000,"Dana Desa/DD"
"2.2.3","Program Upaya Kesehatan Masyarakat",7302870,
"2.2.3.1","Penyuluhan tentang Pemberantasan Penyakit Menular",1442870,"PJK"
"2.2.3.10","Pembinaan Pengelolaan Tanaman Obat Keluarga (TOGA)",5860000,"Dana Desa/DD"
"2.2.4","Program Promosi Kesehatan dan Pemberdayaan Masyarakat",54895000,
"2.2.4.3","Pembinaan Kader Kesehatan/Keluarga Berencana",28545000,"Dana Desa/DD"
"2.2.4.4","Pengembangan Desa Siaga",5100000,"Dana Desa/DD"
"2.2.4.7","Pembinaan dan Pengembangan Pos Pelayanan Terpadu (Posyandu)",11250000,"Dana Desa/DD"
"2.2.4.9","Pemberian Bantuan Stimulan Jamban Sehat",10000000,"Dana Desa/DD"
"2.2.5","Program Pembangunan Infrastruktur",332300000,
"2.2.5.1","Pembangunan Jalan Desa (Gebang-Turunan, Temuireng II-Sanglor II)",166510000,"Dana Desa/DD"
"2.2.5.2","Pembangunan Jembatan Desa (Turunan)",41130000,"Dana Desa/DD"
"2.2.5.4","Pembangunan Turap/Talud/Bronjong Jalan Desa (Nganjan)",64310000,"Dana Desa/DD"
"2.2.5.5","Pembangunan Saluran Drainase/Gorong-Gorong (Sumber dan Sanglor)",35350000,"Dana Desa/DD"
"2.2.5.7","Pembangunan Gapura (Desa)",10000000,"Alokasi Dana Desa/ADD"
"2.2.5.9","Rehabilitasi/Pemeliharaan Jembatan Desa (Pacar II)",15000000,"Dana Desa/DD"
"2.2.7","Program Pengembangan, Pengelolaan, dan Konservasi Sungai",15000000,
"2.2.7.2","Pemeliharaan dan Rehabilitasi Embung dan Bangunan Penampung Air",15000000,"Dana Desa/DD"
"2.2.9","Program Pengembangan Ekonomi Lokal",80882500,
"2.2.9.1","Pengembangan Obyek Wisata yang Dikelola Desa (Watu Payung)",60000000,"Dana Desa/DD"
"2.2.9.2","Pembentukan dan Pengembangan Badan Usaha Milik Desa/BUMDesa",6500000,"Dana Desa/DD"
"2.2.9.8","Pengembangan Kelompok Perikanan dan Pertanian",6000000,"Dana Desa/DD"
"2.2.9.16","Pelatihan Keterampilan Ekonomi Produktif (Kulit Sintesis)",8382500,"Dana Desa/DD"
"2.2.11","Program Pengarusutamaan Gender serta Peningkatan Kualitas",9000000,
"2.2.11.1","Sosialisasi yang Terkait dengan Kesetaraan Gender, Pemberdayaan",4890000,"Pendapatan Asli Desa/PADesa"
"2.2.11.5","Sosialisasi Kesehatan Reproduksi pada Remaja",4110000,
"2.3","Bidang Pembinaan Masyarakat Desa",185175000,
"2.3.1","Program Pembinaan Lembaga Kemasyarakatan Desa",10500000,
"2.3.1.1","Pembinaan Rukun Tetangga (RT)/Rukun Warga (RW)",4150000,"Alokasi Dana Desa/ADD"
"2.3.1.2","Pembinaan Pembinaan Kesejahteraan Keluarga (PKK)",3700000,"Alokasi Dana Desa/ADD"
"2.3.1.3","Pembinaan Karang Taruna",2650000,"Alokasi Dana Desa/ADD"
"2.3.2","Program Peningkatan Nasionalisme dan Perlindungan Masyarakat",36238900,
"2.3.2.1.a","Peringatan Hari Besar Nasional (HUT RI)",11300000,"Alokasi Dana Desa/ADD"
"2.3.2.1.b","Peringatan Hari Besar Nasional (Hari Kartini)",8975000,"Alokasi Dana Desa/ADD"
"2.3.2.2","Pembinaan Satuan Perlindungan Masyarakat",7480000,"Alokasi Dana Desa/ADD"
"2.3.2.4","Pengadaan Peralatan Pendukung Keamanan dan Ketertiban",4000000,"Dana Desa/DD"
"2.3.25","Pembinaan Keamanan dan Ketertiban Masyarakat (Kamtibmas)",4483900,"Dana Desa/DD"
"2.3.3","Program Kepemudaan dan Olahraga",16369000,
"2.3.3.2","Penyuluhan Bahaya Narkotika, Psikotropika, dan Obat-Obatan Terlarang (NAPZA), serta Terorisme kepada Pemuda",4070000,"Dana Desa/DD"
"2.3.3.3","Pembinaan Pemuda di Bidang Olahraga",2800000,"Dana Desa/DD"
"2.3.3.8","Penyelenggaraan Kompetisi Olahraga",9499000,"Dana Desa/DD"
"2.3.4","Program Penanggulangan Kemiskinan dan Penyandang Masalah",23867500,
"2.3.4.2","Analisis Kemiskinan Partisipatif (AKP)/ Validasi",11000000,"Dana Desa/DD"
"2.3.4.3","Pelatihan Keterampilan Berusaha bagi Keluarga Miskin",5367500,"Dana Desa/DD"
"2.3.4.4","Optimalisasi Peran Tim Koordinasi Penanggulangan Kemiskinan Desa",7500000,"Dana Desa/DD"
"2.3.5","Program Pengembangan Nilai Budaya dan Sosial Keagamaan",98199600,
"2.3.5.2","Pembinaan dan Pengembangan Seni Budaya Daerah",29575000,"Dana Desa/DD"
"2.3.5.3.a","Pelaksanaan Gelar Budaya dalam Rangka Hari Jadi Girisuko (Kirab Budaya)",38225000,"Dana Desa/DD"
"2.3.5.3.b","Festival Ketoprak",15299600,"Dana Desa/DD"
"2.3.5.4","Pengembangan Kehidupan Sosial Keagamaan",8100000,"Pengembalian Retribusi dan Pajak"
"2.3.5.5","Pemberian Stimulan Kegiatan Keagamaan",7000000,"Pengembalian Retribusi dan Pajak"
"2.4","Bidang Pemberdayaan Masyarakat Desa",135714100,
"2.4.1","Program Peningkatan Kapasitas Kepala Desa dan Perangkat Desa",18496600,
"2.4.1.1","Pelatihan Aparatur Pemerintah Desa di Bidang Perencanaan",5344100,"Alokasi Dana Desa/ADD"
"2.4.1.4","Pelatihan Aparatur Pemerintah Desa di Bidang Administrasi Desa",3270000,"Alokasi Dana Desa/ADD"
"2.4.1.5","Peningkatan Kapasitas Anggota Badan Permusyawaratan Desa (BPD)",9882500,"Pengembalian Retribusi dan Pajak"
"2.4.2","Program Peningkatan Partisipasi Masyarakat Pedesaan",102977500,
"2.4.2.1","Pembinaan Lembaga Pemberdayaan Masyarakat Desa/LPMD",1502500,"Alokasi Dana Desa/ADD"
"2.4.2.4","Pelaksanaan Evaluasi/Perlombaan Desa",11475000,"Alokasi Dana Desa/ADD"
"2.4.2.5","Pemberian Stimulan Pembangunan Infrastruktur Padukuhan",90000000,"Dana Desa/DD"
"2.4.3","Program Pemberdayaan Kelompok Masyarakat Pedesaan",14240000,
"2.4.3.5","Pelatihan Kelompok Kerajinan",14240000,
"2.5","BELANJA TAK TERDUGA",11110000,
"2.5.1","Belanja Kegiatan Keadaan Darurat",11110000,
"2.5.1.1","Kegiatan Penanggulangan Bencana Alam",11110000,"Pendapatan Asli Desa/PADesa, Alokasi Dana Desa/ADD"
,"JUMLAH BELANJA",1582242770,
3,"PEMBIAYAAN",,
"3.1","Penerimaan Pembiayaan",23687640,
"3.1.1","Sisa Lebih Perhitungan Anggaran (SILPA)",23687640,
"3.2","Pengeluaran Pembiayaan",23687640,
"3.2.1","Pembentukan Dana Cadangan",23687640,
,"Pengisian Perangkat Desa",20000000,
,"Kegiatan Penanggulangan Kejadian Luar Biasa/Wabah",3687640,
,"Pembiayaan Netto/Bersih",0,
