Judul,Penjabaran Anggaran Pendapatan dan Belanja Daerah,,,,,
Daerah,Kabupaten Gunungkidul,,,,,
tahun ,2016,,,,,
Kode Organisasi,2.06,,,,,
Nama Organisasi,Kantor Pengelolaan Pasar,,,,,
Kolom,4,,,,,
Kode Rekening,URAIAN,jumlah,Penjelasan,,,
2.06.2.06.02.00.00.4. ,PENDAPATAN ,2519720732.17,,,,
2.06.2.06.02.00.00.8. ,PENDAPATAN - LO ,2519720732.17,,,,
2.06.2.06.02.00.00.4.1. ,PENDAPATAN ASLI DAERAH ,2519720732.17,,,,
2.06.2.06.02.00.00.4.1.2. ,HASIL RETRIBUSI DAERAH ,2043808500,,,,
2.06.2.06.02.00.00.4.1.2.01. ,Retribusi Jasa Umum ,1481246500,,,,
2.06.2.06.02.00.00.4.1.2.01.02. ,Retribusi Pelayanan Persampahan/Kebersihan ,166027600,Dasar Hukum: Berdasarkan Perda No 13 Tahun 2012 LD Tahun 2012 No 5 Seri C. Retribusi Pelayanan Persampahan/Kebersihan Kemantren Pasar Wonosari 42325200.00 Kemantren Pasar Playen 21470000.00 Kemantren asar Paliyan Panggang 13740300.00 Kemantren Pasar Ngawen-Semin 19675700.00 Kemantren Pasar Semanu-Karangmojo 23550000.00 Kemantren Pasar Ponjong 16137100.00 Kemantren Pasar Rongkop 14260000.00 Kemantren pasar Tepus 3809300.00 Kemantren Pasar Nglipar 11060000.00,,,
2.06.2.06.02.00.00.4.1.2.01.04. ,Retribusi Pelayanan Pasar ,1315218900,Dasar Hukum: Berdasarkan Perda No 8 Tahun 2011 LD Tahun 2011 No 2 Seri C. tentang Retribusi Pelayanan Pasar Kemantren Pasar Wonosari 342622000.00 Kemantren Pasar Playen 271296400.00 Kemantren Pasar Paliyan Panggang 80500500.00 Kemantren Pasar Semin-Ngawen 119784200.00 Kemantren Pasar Semanu-Karangmojo 240166000.00 Kemantren Pasar Ponjong 83858800.00 Kemantren Pasar Rongkop 84100000.00 Kemantren Pasar Tepus 26350200.00 Kemantren Pasar Nglipar 66540800.00,,,
2.06.2.06.02.00.00.4.1.2.02. ,Retribusi Jasa Usaha ,562562000,,,,
2.06.2.06.02.00.00.4.1.2.02.01. ,Retribusi Pemakaian Kekayaan Daerah ,167376000,"Dasar Hukum: Berdasarkan Perda No 9 Tahun 2011 LD Tahun 2011 No 3 Seri C. tentang Retribusi  Pemakaian Kekayaan Daerah Retribusi MCk 167376000.00 Pasar Argosari Lt 1 (Sebelah Timur) 29000000.00 Pasar Argosari Lt 1 (Sebelah Aelatan) 18500000.00 Pasar Argosari Lt 1 (Sebelah Utara) 7000000.00 Pasar Argosari Lt 1 (Sebelah Selatan) 3000000.00 Pasar Argosari Lt II (Belakang Kantor) 18900000.00 Pasar Argosari Lt II (Sebelah Utara) 16300000.00 Pasar Bambu Kepeksari 750000.00 Taman Parkir Wonosari 10200000.00 Gudang Garam Wonosari 8650000.00 Pasar Ngawu Playen 6700000.00 Pasar Hewan Siyono 2500000.00 Pasar Hewan Siyono 2500000.00 Pasar Siyono (Sebelah Selatan) 2520000.00 Pasar Siyono (Sebelah Utara) 1996000.00 Pasar Trowono 1800000.00 Pasar Umum Munggi 9600000.00 Pasar Hewan Munggi 2500000.00 aqsar Tengeran 2500000.00 Pasar Wonontoro 720000.00 Pasar Semin 10000000.00 Pasar Ngawen 2100000.00 Pasar Ponjong 3000000.00 Pasar Bedoyo 720000.00 Pasar Baran 2200000.00 Pasar Nglipar 750000.00 Pasar Wotgalih 720000.00 Pasar Ngalang 750000.00 Pasar Gedangsari 1500000.00 Dasar Hukum: Berdasarkan Perda No 11 Tahun 2011 LD Tahun 2011 No 5 Seri C.tentang Retribusi 
 Tempat Khusus Parkir Pasar Argosari ( Sebelah Selatan) 33500000.00 Pasar Argosari ( sebelah Barat ) 38000000.00 Pasar Argosari ( Sebelah Timur ) 83000000.00 Pasar Bambu Kepeksari 1800000.00 Pasar Hewan Siyonoharjo 18000000.00 Pasar Hewan Siyonoharjo 18000000.00 Pasar Hewan Siyonoharjo 9000000.00 Pasar Hewan Playen 1500000.00 Pasar Paliyan 2500000.00 Pasar Munggi ( Utara Terminal ) 7200000.00 Pasar Trowono 8500000.00 Pasar Trowono ( Roda 2 ) 8000000.00 Pasar Klampok 2500000.00 Pasar Semin ( Roda 4 ) 4000000.00 Pasar Semin ( Roda 2 Sebelah Barat ) 9500000.00 Pasar Semin ( Roda 2 Sebelah Timur ) 9500000.00 Pasar Ngawen ( Roda @. Roda 4 ) 5000000.00 Pasar Munggi 22700000.00 Pasar Hewan Munggi 9500000.00 Pasar Karangmojo 11500000.00 Pasar Wonontoro 1656000.00 Pasar Ponjong 9000000.00 Pasar Jimbaran 4400000.00 Pasar Baran 6000000.00 Pasar Ngrancah 2880000.00 Pasar Mentel. Tepus. Ngeplang 3700000.00 Pasar Nglipar ( Roda 4 ) 6250000.00 Pasar Nglipar. Wotgaleh ( Roda 2 ) 10000000.00 Pasar Wotgalih ( Roda 4 ) 2000000.00 Pasar Gedangsari 2500000.00 Pasar Ngawu Playen 40000000.00 Pasar Legundi 3600000.00",,,
2.06.2.06.02.00.00.4.1.2.02.03. ,Retribusi Tempat Khusus Parkir ,395186000,,,,
2.06.2.06.02.00.00.4.1.4. ,LAIN-LAIN PENDAPATAN ASLI DAERAH YANG SAH ,475912232.17,,,,
2.06.2.06.02.00.00.4.1.4.13. ,Penerimaan Penempatan/Perpanjangan Kios dan Los,475912232.17,,,,
2.06.2.06.02.00.00.4.1.4.13.01. ,Penempatan/Perpanjangan Kios dan Los ,475912232.17,Dasar Hukum: Berdasarkan Perda No 5 Tahun 2011 LD No 2 Tahun 2011 Seri E.tentang Pengelolaan   Barang Milik Daerah Kemantren Pasar Wonosari 11305106.29 Kemantren Pasar Playen 4982163.11 Kemantren Pasar Paliyan Panggang 890488.59 Kemantren Pasar Semin-Ngawen 274037630.22 Kemantren Pasar Semanu-Karangmojo 171249159.93 Kemantren Pasar Ponjong 4767808.54 Kemantren Pasar Rongkop 3921753.98 Kemantren Pasar Tepus 42028.96 Kemantren Pasar Nglipar 4716092.55,,,
2.06.2.06.02.00.00.5. ,BELANJA DAERAH ,13557161501.58,,,,
2.06.2.06.02.00.00.9. ,BEBAN ,13557161501.58,,,,
2.06.2.06.02.00.00.5.1. ,BELANJA TIDAK LANGSUNG ,4621019501.58,,,,
2.06.2.06.02.00.00.5.1.1. ,BELANJA PEGAWAI ,4621019501.58,,,,
2.06.2.06.02.00.00.5.1.1.01. ,Gaji dan Tunjangan ,4521616490.33,,,,
2.06.2.06.02.00.00.5.1.1.01.001. ,Gaji Pokok/Uang Representasi ,3502764417.6,Gol IV 66420270.00 Gol III 659323337.40 Gol II 2405097198.00 Gol I 371923612.20,,,
2.06.2.06.02.00.00.5.1.1.01.002. ,Tunjangan Keluarga ,401459716.73,Tunjangan istri 310308524.82 Tunjangan anak 91151191.91,,,
2.06.2.06.02.00.00.5.1.1.01.003. ,Tunjangan Jabatan ,47880000,Tunjangan struktural 47880000.00,,,
2.06.2.06.02.00.00.5.1.1.01.005. ,Tunjangan Fungsional Umum ,221480000,Tunjangan umum 221480000.00,,,
2.06.2.06.02.00.00.5.1.1.01.006. ,Tunjangan Beras ,299094600,Tunjangan beras 299094600.00,,,
2.06.2.06.02.00.00.5.1.1.01.007. ,Tunjangan PPh/Tunjangan Khusus ,48873818,Tunjangan PPH 48873818.00,,,
2.06.2.06.02.00.00.5.1.1.01.008. ,Pembulatan Gaji ,63938,Pembulatan gaji 63938.00,,,
2.06.2.06.02.00.00.5.1.1.06. ,Insentif Pemungutan Retribusi Daerah ,99403011.25,,,,
2.06.2.06.02.00.00.5.1.1.06.001. ,Insentif  Pemungutan Retribusi Daerah ,99403011.25,Insentif pemungutan retribusi daerah 99403011.25 Insentif pemungutan retribusi daerah Triwulan IV Tahun 2015 26979407.50 Insentif pemungutan retribusi daerah Triwulan I. II. III Tahun 2016 72423603.75,,,
2.06.2.06.02.00.00.5.2. ,BELANJA LANGSUNG ,8936142000,,,,
2.06.2.06.02.01. ,PROGRAM PELAYANAN ADMINISTRASI PERKANTORAN,727527000,,,,
2.06.2.06.02.01.01. ,PENYEDIAAN JASA SURAT MENYURAT ,50000,Lokasi Kegiatan: Kantor Pengelolaan Pasar Sumber Dana: PAD.  DAU.  Bagi Hasil Pajak Prov.,,,
2.06.2.06.02.01.01.5.2.2. ,BELANJA BARANG DAN JASA ,50000,,,,
2.06.2.06.02.01.01.5.2.2.01. ,Belanja Bahan Pakai Habis ,50000,,,,
2.06.2.06.02.01.01.5.2.2.01.004. ,Belanja perangko/meterai ,50000,Belanja perangko/pengiriman surat 50000.00,,,
2.06.2.06.02.01.02. ,PENYEDIAAN JASA KOMUNIKASI^SUMBER DAYA ,198000000,Lokasi Kegiatan: Kantor Pengelolaan Pasar AIR DAN LISTRIK Sumber Dana: PAD.  Bagi Hasil Pajak Prov.,,,
2.06.2.06.02.01.02.5.2.2. ,BELANJA BARANG DAN JASA ,198000000,,,,
2.06.2.06.02.01.02.5.2.2.03. ,Belanja Jasa Kantor ,198000000,,,,
2.06.2.06.02.01.02.5.2.2.03.001. ,Belanja telephon/kawat/faximile/internet ,6000000, Belanja rekening telepon 6000000.00,,,
2.06.2.06.02.01.02.5.2.2.03.002. ,Belanja air ,6000000, Belanja rekening air 6000000.00,,,
2.06.2.06.02.01.02.5.2.2.03.003. ,Belanja listrik ,186000000, Belanja rekening listrik 186000000.00,,,
2.06.2.06.02.01.03. ,PENYEDIAAN JASA PERALATAN^ PERLENGKAPAN ,36400000,Lokasi Kegiatan: Pasar Ngeplang. Hewan Ngawu. Pakel. Bambu.Jepitu.Kaisihan.Wiladeg.Ngrancah. KANTOR^ GEDUNG^ DAN TANAH Trowono. Hewan Semin. Hewan Rongkop Sumber Dana: PAD.  DAU.,,,
2.06.2.06.02.01.03.5.2.2. ,BELANJA BARANG DAN JASA ,36400000,,,,
2.06.2.06.02.01.03.5.2.2.07. ,Belanja Sewa Rumah/Gedung/Gudang/Parkir ,36400000,,,,
2.06.2.06.02.01.03.5.2.2.07.005. ,Belanja Sewa Tanah ,36400000, Belanja sewa tanah 36400000.00 Sewa tanah Pasar Ngeplang 2000000.00 Pasar Hewan Semin 4500000.00 Pasar Hewan Rongkop 2200000.00  Pasar Wiladeg 1500000.00 Pasar Hewan Ngawu 4000000.00 Pasar Pakel 2500000.00 Pasar Bambu 6000000.00 Pasar Jepitu 4000000.00 Pasar Kasihan 1200000.00 Pasar Ngrancah 4000000.00 Pasar Trowono 4500000.00,,,
2.06.2.06.02.01.04. ,PENYEDIAAN JASA PEMELIHARAAN DAN ,11150000,Lokasi Kegiatan: Kantor Pengelolaan Pasar PERIZINAN KENDARAAN DINAS/OPERASIONAL Sumber Dana: DAU.,,,
2.06.2.06.02.01.04.5.2.2. ,BELANJA BARANG DAN JASA ,11150000,,,,
2.06.2.06.02.01.04.5.2.2.05. ,Belanja Perawatan Kendaraan Bermotor ,11150000,,,,
2.06.2.06.02.01.04.5.2.2.05.005. ,Belanja Surat Tanda Nomor Kendaraan ,11150000, STNK/pajak roda 4 1200000.00 STNK/pajak roda 2 5100000.00 STNK/pajak Pic up armada sampah 1600000.00 STNK/pajak  Dump Truk armada sampah 3000000.00 STNK/pajak viar 250000.00,,,
2.06.2.06.02.01.07. ,PENYEDIAAN JASA PERBAIKAN PERALATAN KERJA ,9000000,Lokasi Kegiatan: -Kantor Pengelolaan Pasar Sumber Dana: PAD.  DAU.  Bagi Hasil Pajak Prov.,,,
2.06.2.06.02.01.07.5.2.2. ,BELANJA BARANG DAN JASA ,9000000,,,,
2.06.2.06.02.01.07.5.2.2.18. ,Belanja perawatan peralatan dan perlengkapan ,9000000, kantor,,,
2.06.2.06.02.01.07.5.2.2.18.001. ,Belanja pemeliharaan perlatan kantor ,9000000, ( Biaya pemeliharaan komputer. printer. laptop. mesin tik. LCD ) 9000000.00,,,
2.06.2.06.02.01.08. ,PENYEDIAAN ALAT TULIS KANTOR ,18750000,Lokasi Kegiatan: Kantor Pengelolaan Pasar- Sumber Dana: DAU.,,,
2.06.2.06.02.01.08.5.2.2. ,BELANJA BARANG DAN JASA ,18750000,,,,
2.06.2.06.02.01.08.5.2.2.01. ,Belanja Bahan Pakai Habis ,18750000,,,,
2.06.2.06.02.01.08.5.2.2.01.001. ,Belanja alat tulis kantor ,18750000, Belanja ATK 18750000.00,,,
2.06.2.06.02.01.09. ,PENYEDIAAN BARANG CETAKAN DAN ,35242000,Lokasi Kegiatan: Kantor Pengelolaan Pasar PENGGANDAAN Sumber Dana: PAD.  DAU.,,,
2.06.2.06.02.01.09.5.2.2. ,BELANJA BARANG DAN JASA ,35242000,,,,
2.06.2.06.02.01.09.5.2.2.06. ,Belanja Cetak dan Penggandaan ,35242000,,,,
2.06.2.06.02.01.09.5.2.2.06.001. ,Belanja Cetak ,22742000, Belanja cetak 22742000.00,,,
2.06.2.06.02.01.09.5.2.2.06.002. ,Belanja Penggandaan/Foto copy ,12500000, Belanja penggandaan 12500000.00,,,
2.06.2.06.02.01.10. ,PENYEDIAAN KOMPONEN INSTALASI ,113500000,Lokasi Kegiatan: Kantor Pengelolaan Pasar LISTRIK/PENERANGAN BANGUNAN KANTOR Sumber Dana: DAU.,,,
2.06.2.06.02.01.10.5.2.2. ,BELANJA BARANG DAN JASA ,7300000,,,,
2.06.2.06.02.01.10.5.2.2.01. ,Belanja Bahan Pakai Habis ,6000000,,,,
2.06.2.06.02.01.10.5.2.2.01.003. ,Belanja alat listrik dan elektronika (lampu pijar^ batery ,6000000, keri Belanja alat listrik dan elektronika (Kabel. MCB. Feting. Rol. Travo. Lampu. 6000000.00 Meteran Listrik. starter. klem. roosten),,,
2.06.2.06.02.01.10.5.2.2.03. ,Belanja Jasa Kantor ,1300000,,,,
2.06.2.06.02.01.10.5.2.2.03.006. ,Belanja jasa tenaga harian lepas/upah tenaga ,1300000, Belanja upah tukang 1300000.00,,,
2.06.2.06.02.01.10.5.2.3. ,BELANJA  MODAL ,106200000,,,,
2.06.2.06.02.01.10.5.2.3.25. ,Belanja Modal Pengadaan Instalasi Listrik dan ,106200000, Telepon,,,
2.06.2.06.02.01.10.5.2.3.25.001. ,Belanja Modal Pengadaan Instalasi Listrik. ,106200000, Belanja pemasangan instalasi dan meteran listrik 105600000.00 Daya 450 VA 73100000.00 daya 1300 VA 24000000.00 Pemasangan instalasi listrik Pasar Klampok 3500000.00 Pemasangan listrik Pasar sambeng 3500000.00 tambah daya Pasar Trowono 1500000.00 Honor Pejabat Pengadaan 300000.00 Honor pejabat penerima 300000.00,,,
2.06.2.06.02.01.11. ,PENYEDIAAN PERALATAN DAN PERLENGKAPAN ,147850000,Lokasi Kegiatan: Kantor Pengelolaan Pasar KANTOR Sumber Dana: PAD.  DAU.,,,
2.06.2.06.02.01.11.5.2.3. ,BELANJA  MODAL ,147850000,,,,
2.06.2.06.02.01.11.5.2.3.11. ,Belanja Modal Pengadaan Perlengkapan Kantor ,24000000,,,,
2.06.2.06.02.01.11.5.2.3.11.007. ,Belanja modal AC ,24000000, Belanja AC 24000000.00,,,
2.06.2.06.02.01.11.5.2.3.12. ,Belanja Modal Pengadaan Komputer ,106600000,,,,
2.06.2.06.02.01.11.5.2.3.12.002. ,Belanja modal pengadaan komputer /PC ,85600000, Pengadaan Komputer 85000000.00 Honor pejabat pengadaan` 300000.00 Honor pejabat penerima 300000.00,,,
2.06.2.06.02.01.11.5.2.3.12.003. ,Belanja modal pengadaan printer ,13500000, Belanja printer 13500000.00,,,
2.06.2.06.02.01.11.5.2.3.12.004. ,Belanja modal pengadaan notebook/laptop ,7500000, Belanja lap top 7500000.00,,,
2.06.2.06.02.01.11.5.2.3.16. ,Belanja Modal Pengadaan Alat-alat Studio ,6750000,,,,
2.06.2.06.02.01.11.5.2.3.16.003. ,Belanja modal pengadaan proyektor ,6750000, Belanja proyektor 6750000.00,,,
2.06.2.06.02.01.11.5.2.3.17. ,Belanja Modal Pengadaan Alat-alat Komunikasi ,10500000,,,,
2.06.2.06.02.01.11.5.2.3.17.002. ,Belanja modal pengadaan faximile ,2000000, belanja faximile 2000000.00,,,
2.06.2.06.02.01.11.5.2.3.17.008. ,Belanja modal pengadaan sound sistem ,8500000, Belanja sound sistem/horn 8500000.00,,,
2.06.2.06.02.01.12. ,PENYEDIAAN PERALATAN RUMAH TANGGA ,12000000,Lokasi Kegiatan: -Kantor Pengelolaan Pasar Sumber Dana: PAD.  DAU.  Bagi Hasil Pajak Prov.,,,
2.06.2.06.02.01.12.5.2.2. ,BELANJA BARANG DAN JASA ,3000000,,,,
2.06.2.06.02.01.12.5.2.2.01. ,Belanja Bahan Pakai Habis ,3000000,,,,
2.06.2.06.02.01.12.5.2.2.01.005. ,Belanja peralatan kebersihan dan bahan pembersih ,3000000, Belanja peralatan kebersihan dan bahan pembersih kantor 3000000.00,,,
2.06.2.06.02.01.12.5.2.3. ,BELANJA  MODAL ,9000000,,,,
2.06.2.06.02.01.12.5.2.3.10. ,Belanja Modal Pengadaan Peralatan Kantor ,9000000,,,,
2.06.2.06.02.01.12.5.2.3.10.011. ,Belanja modal pengadaan tabung pemadam kebakaran ,9000000, Pengadaan tabung pemadam kebakaran 9000000.00,,,
2.06.2.06.02.01.13. ,PENYEDIAAN BAHAN BACAAN DAN PERATURAN ,2040000,Lokasi Kegiatan: Kantor Pengelolaan Pasar PERUNDANG-UNDANGAN Sumber Dana: PAD.  DAU.  Bagi Hasil Pajak Prov.,,,
2.06.2.06.02.01.13.5.2.2. ,BELANJA BARANG DAN JASA ,2040000,,,,
2.06.2.06.02.01.13.5.2.2.03. ,Belanja Jasa Kantor ,2040000,,,,
2.06.2.06.02.01.13.5.2.2.03.005. ,Belanja surat kabar/majalah ,2040000, Belanja surat kabar 2040000.00,,,
2.06.2.06.02.01.15. ,PENYEDIAAN MAKANAN DAN MINUMAN ,8725000,Lokasi Kegiatan: Kantor Pengelolaan Pasar Sumber Dana: DAU.,,,
2.06.2.06.02.01.15.5.2.2. ,BELANJA BARANG DAN JASA ,8725000,,,,
2.06.2.06.02.01.15.5.2.2.11. ,Belanja Makanan dan Minuman ,8725000,,,,
2.06.2.06.02.01.15.5.2.2.11.002. ,Belanja makanan dan minuman rapat ,6125000, Belanja makan rapat 4400000.00 Belanja minum snack rapat 1725000.00,,,
2.06.2.06.02.01.15.5.2.2.11.003. ,Belanja makanan dan minuman tamu ,2600000, Belanja makan tamu 1700000.00 Belanja minum snack tamu 900000.00,,,
2.06.2.06.02.01.16. ,RAPAT-RAPAT KOORDINASI DAN KONSULTASI KE ,41220000,Lokasi Kegiatan: dalam daerah dan jabodetabek LUAR DAERAH Sumber Dana: DAU.,,,
2.06.2.06.02.01.16.5.2.2. ,BELANJA BARANG DAN JASA ,41220000,,,,
2.06.2.06.02.01.16.5.2.2.15. ,Belanja Perjalanan Dinas ,41220000,,,,
2.06.2.06.02.01.16.5.2.2.15.001. ,Belanja perjalanan dinas dalam daerah ,31960000, Gol IV 2400000.00 Gol III 18000000.00 Gol II 8000000.00 Perjalanan dinas ke propinsi DIY Gol IV 560000.00 Gol III 1800000.00 Gol II 1200000.00,,,
2.06.2.06.02.01.16.5.2.2.15.002. ,Belanja perjalanan dinas luar daerah ,9260000, Gol IV 2730000.00 Uang harian 1590000.00 Penginapan 800000.00 Uang taksi 340000.00 Gol III 2530000.00 Uang harian 1590000.00 Penginapan 600000.00 Uang taksi 340000.00 tiket 4000000.00,,,
2.06.2.06.02.01.17. ,PENYEDIAAN JASA TENAGA ,93600000,Lokasi Kegiatan: Kantor Pengelolaan Pasar ADMINISTRASI/TEKNIK PERKANTORAN Sumber Dana: PAD.  DAU.,,,
2.06.2.06.02.01.17.5.2.1. ,BELANJA PEGAWAI ,93600000,,,,
2.06.2.06.02.01.17.5.2.1.02. ,Honorarium Non PNS ,93600000,,,,
2.06.2.06.02.01.17.5.2.1.02.001. ,Honorarium Tenaga Kontrak ,93600000, Petugas pungut 15600000.00 petugas satpam 2 x 13 bulan 31200000.00 Petugas ME 3 x 13 bulan 46800000.00,,,
2.06.2.06.02.02. ,PROGRAM PENINGKATAN SARANA DAN ,287875200, PRASARANA APARATUR,,,
2.06.2.06.02.02.08. ,PENGADAAN MEBELAIR ,70650000,Lokasi Kegiatan: Kantor Pengelolaan Pasar Sumber Dana: PAD.  DAU.,,,
2.06.2.06.02.02.08.5.2.3. ,BELANJA  MODAL ,70650000,,,,
2.06.2.06.02.02.08.5.2.3.11. ,Belanja Modal Pengadaan Perlengkapan Kantor ,16800000,,,,
2.06.2.06.02.02.08.5.2.3.11.002. ,Belanja modal pengadaan almari ,16800000, Belanja almari arsip 8000000.00 Pengadaan almari etalase 1800000.00 pengadaan almari kayu 7000000.00,,,
2.06.2.06.02.02.08.5.2.3.13. ,Belanja Modal Pengadaan Mebeulair ,45850000,,,,
2.06.2.06.02.02.08.5.2.3.13.001. ,Belanja modal pengadaan meja kerja ,18000000, Belanja meja telepon 500000.00 Meja komputer 8500000.00 pengadaan meja kerja 9000000.00,,,
2.06.2.06.02.02.08.5.2.3.13.002. ,Belanja modal pengadaan meja rapat ,14000000, Belanja meja rapat 14000000.00,,,
2.06.2.06.02.02.08.5.2.3.13.004. ,Belanja modal pengadaan kursi kerja ,4500000, pengadaan kursi kerja 4500000.00,,,
2.06.2.06.02.02.08.5.2.3.13.005. ,Belanja modal pengadaan kursi rapat ,8000000, Belanja kursi rapat 8000000.00,,,
2.06.2.06.02.02.08.5.2.3.13.011. ,Belanja modal pengadaan kursi tunggu ,1350000, Pengadaan kursi tunggu 1350000.00,,,
2.06.2.06.02.02.08.5.2.3.28. ,Belanja Modal Pengadaan Barang bercorak ,8000000, Kesenian^ Kebudayaan,,,
2.06.2.06.02.02.08.5.2.3.28.006. ,Belanja modal pengadaan maket/miniatur/diorama ,8000000, Pengadaan maket pasar 8000000.00,,,
2.06.2.06.02.02.10. ,PEMELIHARAAN RUTIN/BERKALA GEDUNG KANTOR ,122032000,Lokasi Kegiatan: Kantor Pengelolaan Pasar Sumber Dana: DAU.,,,
2.06.2.06.02.02.10.5.2.2. ,BELANJA BARANG DAN JASA ,100000000,,,,
2.06.2.06.02.02.10.5.2.2.02. ,Belanja Bahan/Material ,70000000,,,,
2.06.2.06.02.02.10.5.2.2.02.001. ,Belanja bahan baku bangunan ,70000000, Kemantren Pasar Semin 5000000.00 kemantren Pasar Rongkop 10000000.00 Kemantren Pasar Ponjong 10000000.00 Kemantren Pasar Semanu Karangmojo 5000000.00 Kemantren Pasar Tepus 5000000.00 Kemantren Pasar Wonosari 10000000.00 Kemantren Pasar Playen 10000000.00 Kemantren Pasar Nglipar Gedangsari 10000000.00 Kemantren Pasar Paliyan panggang 5000000.00,,,
2.06.2.06.02.02.10.5.2.2.03. ,Belanja Jasa Kantor ,30000000,,,,
2.06.2.06.02.02.10.5.2.2.03.006. ,Belanja jasa tenaga harian lepas/upah tenaga ,30000000, Belanja upah tenaga 30000000.00,,,
2.06.2.06.02.02.10.5.2.3. ,BELANJA  MODAL ,22032000,,,,
2.06.2.06.02.02.10.5.2.3.11. ,Belanja Modal Pengadaan Perlengkapan Kantor ,22032000,,,,
2.06.2.06.02.02.10.5.2.3.11.021. ,Belanja modal papan nama ,22032000, Pengadaan papan nama pasar 17550000.00 Belanja papan nama 4482000.00,,,
2.06.2.06.02.02.11. ,PEMELIHARAAN RUTIN/BERKALA KENDARAAN ,45400000,Lokasi Kegiatan: Kantor Pengelolaan Pasar DINAS/OPERASIONAL Sumber Dana: PAD.,,,
2.06.2.06.02.02.11.5.2.2. ,BELANJA BARANG DAN JASA ,45400000,,,,
2.06.2.06.02.02.11.5.2.2.05. ,Belanja Perawatan Kendaraan Bermotor ,45400000,,,,
2.06.2.06.02.02.11.5.2.2.05.001. ,Belanja pemeliharaan kendaraan ,18650000, Belanja servis. suku cadang aki ban roda 4 5900000.00 Belanja servis. suku cadang aki ban roda 2 12750000.00,,,
2.06.2.06.02.02.11.5.2.2.05.003. ,Belanja Bahan Bakar Minyak dan Pelumas ,26750000, kendaraan dinas roda 4 14000000.00 kendaraan dinas roda 2 12750000.00,,,
2.06.2.06.02.02.13. ,PEMELIHARAAN RUTIN/BERKALA PERALATAN ,39793200,Lokasi Kegiatan: Kantor Pengelolaan Pasar GEDUNG KANTOR Sumber Dana: PAD.,,,
2.06.2.06.02.02.13.5.2.2. ,BELANJA BARANG DAN JASA ,39793200,,,,
2.06.2.06.02.02.13.5.2.2.01. ,Belanja Bahan Pakai Habis ,2000000,,,,
2.06.2.06.02.02.13.5.2.2.01.007. ,Belanja pengisian tabung pemadam kebakaran ,2000000, Belanja servis tabung pemadam kebakaran 2000000.00,,,
2.06.2.06.02.02.13.5.2.2.18. ,Belanja perawatan peralatan dan perlengkapan ,37793200, kantor,,,
2.06.2.06.02.02.13.5.2.2.18.002. ,Belanja pemeliharaan perlengkapan kantor ,37793200, pemeliharaan hidran. water torn 37793200.00,,,
2.06.2.06.02.02.14. ,PEMELIHARAAN RUTIN/BERKALA MEBELAIR ,10000000,Lokasi Kegiatan: Kantor Pengelolaan Pasar Sumber Dana: DAU.,,,
2.06.2.06.02.02.14.5.2.2. ,BELANJA BARANG DAN JASA ,10000000,,,,
2.06.2.06.02.02.14.5.2.2.18. ,Belanja perawatan peralatan dan perlengkapan ,10000000, kantor,,,
2.06.2.06.02.02.14.5.2.2.18.001. ,Belanja pemeliharaan perlatan kantor ,10000000, Belanja pemeliharaan mebelair kantor 10000000.00,,,
2.06.2.06.02.03. ,PROGRAM PENINGKATAN DISIPLIN APARATUR ,15930000,,,,
2.06.2.06.02.03.01. ,PENGADAAN PAKAIAN KHUSUS HARI-HARI ,5600000,Lokasi Kegiatan: Kantor Pengelolaan Pasar TERTENTU Sumber Dana: PAD.  DAU.,,,
2.06.2.06.02.03.01.5.2.2. ,BELANJA BARANG DAN JASA ,5600000,,,,
2.06.2.06.02.03.01.5.2.2.13. ,Belanja Pakaian Kerja ,5600000,,,,
2.06.2.06.02.03.01.5.2.2.13.001. ,Belanja pakaian kerja lapangan ,5600000, Belanja seragam satpam dan jaga malam 5600000.00,,,
2.06.2.06.02.03.02. ,PENATALAKSANAAN KEPEGAWAIAN SKPD ,10330000,Lokasi Kegiatan: Kantor Pengelolaan Pasar Sumber Dana: PAD.  DAU.  Bagi Hasil Pajak Prov.,,,
2.06.2.06.02.03.02.5.2.1. ,BELANJA PEGAWAI ,200000,,,,
2.06.2.06.02.03.02.5.2.1.01. ,Honorarium PNS ,200000,,,,
2.06.2.06.02.03.02.5.2.1.01.004. ,Honorarium Moderator ,200000, Honor moderator 200000.00,,,
2.06.2.06.02.03.02.5.2.2. ,BELANJA BARANG DAN JASA ,10130000,,,,
2.06.2.06.02.03.02.5.2.2.01. ,Belanja Bahan Pakai Habis ,2800000,,,,
2.06.2.06.02.03.02.5.2.2.01.001. ,Belanja alat tulis kantor ,2800000, Belanja ATK bimtek (note book bollpoint. tas ) 2800000.00,,,
2.06.2.06.02.03.02.5.2.2.03. ,Belanja Jasa Kantor ,80000,,,,
2.06.2.06.02.03.02.5.2.2.03.006. ,Belanja jasa tenaga harian lepas/upah tenaga ,80000, Upah petugas kebersihan 80000.00,,,
2.06.2.06.02.03.02.5.2.2.06. ,Belanja Cetak dan Penggandaan ,2500000,,,,
2.06.2.06.02.03.02.5.2.2.06.002. ,Belanja Penggandaan/Foto copy ,2500000, Belanja penggandaan SKP. KP4 dan surat kepegawaian lainnya 2500000.00,,,
2.06.2.06.02.03.02.5.2.2.11. ,Belanja Makanan dan Minuman ,2750000,,,,
2.06.2.06.02.03.02.5.2.2.11.002. ,Belanja makanan dan minuman rapat ,2750000, Belanja makan 2000000.00 Belanja munum snack 750000.00,,,
2.06.2.06.02.03.02.5.2.2.23. ,Belanja Jasa Narasumber/Tenaga Ahli ,2000000,,,,
2.06.2.06.02.03.02.5.2.2.23.001. ,Belanja jasa narasumber ,2000000, Honorarium narasumber 2000000.00,,,
2.06.2.06.02.05. ,PROGRAM PENINGKATAN PENGEMBANGAN SISTEM ,39325000, PELAPORAN CAPAIAN KINERJA DAN KEUANGAN,,,
2.06.2.06.02.05.01. ,PENYUSUNAN LAPORAN CAPAIAN KINERJA DAN ,1487500,Lokasi Kegiatan: Kantor Pengelolaan Pasar IKHTISAR REALISASI KINERJA SKPD Sumber Dana: PAD.  DAU.,,,
2.06.2.06.02.05.01.5.2.1. ,BELANJA PEGAWAI ,500000,,,,
2.06.2.06.02.05.01.5.2.1.03. ,Uang Lembur ,500000,,,,
2.06.2.06.02.05.01.5.2.1.03.001. ,Uang Lembur PNS ,500000, Gol III/IV 320000.00 Gol II 180000.00,,,
2.06.2.06.02.05.01.5.2.2. ,BELANJA BARANG DAN JASA ,987500,,,,
2.06.2.06.02.05.01.5.2.2.06. ,Belanja Cetak dan Penggandaan ,300000,,,,
2.06.2.06.02.05.01.5.2.2.06.002. ,Belanja Penggandaan/Foto copy ,300000, Belanja penggandaan 300000.00,,,
2.06.2.06.02.05.01.5.2.2.11. ,Belanja Makanan dan Minuman ,687500,,,,
2.06.2.06.02.05.01.5.2.2.11.002. ,Belanja makanan dan minuman rapat ,687500, Belanja makan rapat 500000.00 Minum snack rapat 187500.00,,,
2.06.2.06.02.05.02. ,PENYUSUNAN PELAPORAN KEUANGAN SEMESTERAN ,570000,Lokasi Kegiatan: Kantor Pengelolaan Pasar Sumber Dana: PAD.  Bagi Hasil Pajak Prov.,,,
2.06.2.06.02.05.02.5.2.1. ,BELANJA PEGAWAI ,270000,,,,
2.06.2.06.02.05.02.5.2.1.03. ,Uang Lembur ,270000,,,,
2.06.2.06.02.05.02.5.2.1.03.001. ,Uang Lembur PNS ,270000, Gol IV/III 180000.00 Gol II/I 90000.00,,,
2.06.2.06.02.05.02.5.2.2. ,BELANJA BARANG DAN JASA ,300000,,,,
2.06.2.06.02.05.02.5.2.2.11. ,Belanja Makanan dan Minuman ,300000,,,,
2.06.2.06.02.05.02.5.2.2.11.001. ,Belanja makanan dan minuman harian pegawai ,300000, Belanja makan minum lembur 300000.00,,,
2.06.2.06.02.05.03. ,PENYUSUNAN PELAPORAN KEUANGAN AKHIR ,1427500,Lokasi Kegiatan: Kantor Pengelolaan Pasar TAHUN Sumber Dana: PAD.  DAU.,,,
2.06.2.06.02.05.03.5.2.1. ,BELANJA PEGAWAI ,440000,,,,
2.06.2.06.02.05.03.5.2.1.03. ,Uang Lembur ,440000,,,,
2.06.2.06.02.05.03.5.2.1.03.001. ,Uang Lembur PNS ,440000, Gol IV/II 320000.00 Gol II/I 120000.00,,,
2.06.2.06.02.05.03.5.2.2. ,BELANJA BARANG DAN JASA ,987500,,,,
2.06.2.06.02.05.03.5.2.2.06. ,Belanja Cetak dan Penggandaan ,300000,,,,
2.06.2.06.02.05.03.5.2.2.06.002. ,Belanja Penggandaan/Foto copy ,300000, Belanja penggandaan 300000.00,,,
2.06.2.06.02.05.03.5.2.2.11. ,Belanja Makanan dan Minuman ,687500,,,,
2.06.2.06.02.05.03.5.2.2.11.002. ,Belanja makanan dan minuman rapat ,687500, Makan rapat 500000.00 Minum snack 187500.00,,,
2.06.2.06.02.05.04. ,PENYUSUNAN PELAPORAN KEUANGAN ,35840000,Lokasi Kegiatan: Kantor Pengelolaan Pasar BULANAN/SPJ Sumber Dana: PAD.  DAU.,,,
2.06.2.06.02.05.04.5.2.1. ,BELANJA PEGAWAI ,32940000,,,,
2.06.2.06.02.05.04.5.2.1.01. ,Honorarium PNS ,31500000,,,,
2.06.2.06.02.05.04.5.2.1.01.003. ,Honorarium Bendahara/Pembantu ,31500000, Bendaraha/ppk-skpd/pembantu ppk-skpd Honorararium bendahara pengeluaran 3600000.00 Honorarium pembantu bendahara pengeluaran 6000000.00 Honorarium bendahara penerimaan 2700000.00 Honorarium pembantu bendahara penerimaan 1800000.00 Honorarium Pejabat penatausahaan keuangan 3900000.00 Honorarium pembantu pejabat penatusahaan keuangan 6600000.00 Pengurus barang 3900000.00 Penyimpan barang 3000000.00,,,
2.06.2.06.02.05.04.5.2.1.03. ,Uang Lembur ,1440000,,,,
2.06.2.06.02.05.04.5.2.1.03.001. ,Uang Lembur PNS ,1440000, Gol IV/III 1080000.00 Gol II 360000.00,,,
2.06.2.06.02.05.04.5.2.2. ,BELANJA BARANG DAN JASA ,2900000,,,,
2.06.2.06.02.05.04.5.2.2.01. ,Belanja Bahan Pakai Habis ,1800000,,,,
2.06.2.06.02.05.04.5.2.2.01.004. ,Belanja perangko/meterai ,1800000, Belanja materai 6000 1200000.00 Materai 600000.00,,,
2.06.2.06.02.05.04.5.2.2.06. ,Belanja Cetak dan Penggandaan ,500000,,,,
2.06.2.06.02.05.04.5.2.2.06.002. ,Belanja Penggandaan/Foto copy ,500000, Belanja penggandaan 500000.00,,,
2.06.2.06.02.05.04.5.2.2.11. ,Belanja Makanan dan Minuman ,600000,,,,
2.06.2.06.02.05.04.5.2.2.11.001. ,Belanja makanan dan minuman harian pegawai ,600000, Belanja makan minum lembur 600000.00,,,
2.06.2.06.02.06. ,PROGRAM PENINGKATAN KUALITAS PELAYANAN ,58430000, PUBLIK,,,
