Judul,Penjabaran Anggaran Pendapatan dan Belanja Daerah,,
Daerah,Kabupaten Sleman,,
Tahun,2014,,
Kode Organisasi,1.07.01.00,,
Nama Organisasi,Dinas Perhubungan Komunikasi dan Informatika,,
Kolom,4,,
No. Rekening,Uraian,Jumlah,Keterangan
1.07.01,Dinas Perhubungan dan Informatika,3354614900,
1.07.1.07.01.4.1,Pendapatan Asli Daerah,3354614900,
1.07.1.07.01.5,Dinas Perhubungan dan Informatika,31781037970,
1.07.1.07.01.5.1,Belanja Tidak Langsung,5834528345,
1.07.1.07.01.5.2,Belanja Langsung,25946509625,
1.1.07.01,Urusan Wajib,25946509625,
1.07.1.07.01,Perhubungan,17302725700,
1.07.1.07.01.01, Pelayanan Administrasi Perkantoran,2691433500,
1.07.1.07.01.02, Peningkatan Sarana dan Prasarana Aparatur,1051430000,
1.07.1.07.01.05, Peningkatan Kapasitas Sumber Daya Aparatur,83334000,
1.07.1.07.01.06, Peningkatan Pengembangan Sistem Pelaporan Capaian Kinerja dan Keuangan,210185500,
1.07.1.07.01.15, Pembangunan Prasarana dan Fasilitas Perhubungan,5017429750,
1.07.1.07.01.15.01,Prencanaan Pembangunan Prasarana dan Fasilitas Perhubungan,149069750,Untuk perencanaan perlintasan sebidang jalur kereta api dan DED res area
1.07.1.07.01.15.07,Peningkatan Pengelolaan Terminal Angkutan Darat,606410000,"Untuk peningkatan kualitas prasarana dan fasilitas perhubungan, 5 terminal"
1.07.1.07.01.15.09,Pembangunan Lampu Penerangan Jalan Umum,4217135000,"Untuk pemasangan lampu PJU, 150 titik ddan meterisasi PJU, 5 desa"
1.07.1.07.01.15.11,Inventarisasi LPJU,44815000,"Untuk inventarisasi LPJU/data base, 3 kecamatan"
1.07.1.07.01.16, Rehabilitasi dan Pemeliharaan Prasaranan dan Fasilitas LLAJ,3560183000,
1.07.1.07.01.16.06,Rehabilitasi dan Pemeliharaan LPJU,3425267500,"Untuk OP dan pemeliharaan LPJU, 2850 titik"
1.07.1.07.01.16.07,Operasional Pemeliharaan Fasilitas Lalu Lintas,134915500,"Untuk pemeliharaan fasilitas lalin, 12 bulan"
1.07.1.07.01.17, Peningkatan Pelayanan Angkutan,471366000,
1.07.1.07.01.17.04,Uji Kelayakan Sarana Transportasi Guna Keselamatan Penumpang,57702000,Untuk uji kelayakan angkutan wisata sekolah 400 bus/kendaraan
1.07.1.07.01.17.06,Penciptaan Keamanan dan Kenyamanan Penumpang di Lingkungan Terminal,97805500,Untuk meingkatkan pelayanan kepada penumpang
1.07.1.07.01.17.12,Pengembangan Sarana dan Prasarana Pelayanan Jasa Angkutan,97667000,Untuk penyediaan angkutan pelajar
1.07.1.07.01.17.18,Pelayanan Perijinan di Bidang Perhubungan,8286500,Untuk perijinan angkutan
1.07.1.07.01.17.15,Pemilihan & Pemberian Penghargaan Sopir/Juru Mudik/Awak Kendaraan Angkutan Umum Teladan,11465000,"Seleksi awak kendaraan teladan, 5 orang"
1.07.1.07.01.17.16,Koordinasi dalam Peningkatan Pelayanan Angkutan,155163500,"Pengendalian, pengawasan, sosialisasi, dan kampanye tertib lalin"
1.07.1.07.01.17.17,Forum Manajemen Lalu Lintas,43276500,Peningkatan pelayanan fungsi angkutan jalan
1.07.1.07.01.18, Pembangunan Sarana dan Prasarana Perhubungan,118060000,
1.07.1.07.01.18.02,"Pembangunan Halte Bus, Taxi Gedung Terminal",118060000,"Unruk pembuatan halte, 3 unit"
1.07.1.07.01.19, Peningkatan & Pengamanan Lalu Lintas,3068594500,
1.07.1.07.01.19.01,Pengadaan Rambu-rambu Lalu Lintas,1587285000,Untuk pengadaan rambu-rambu lalu lintas
1.07.1.07.01.19.03,Pengadaan Pagar Pengaman Jalan,101400000,Untuk pengadaan pagar 100 m
1.07.1.07.01.19.05,Pengelolaan Perpakiran,1342465000,"Untuk penyelenggaraan dan optimalisasi parkir, SIM parkir dan perijinan parkir"
1.07.1.07.01.19.06,Survey Lalu Lintas,37444500,Survei 25 lokasi ruas jalan dan 5 lokasi simpang
1.07.1.07.01.20, Peningkatan Kelaikan Pengoperasian Kendaraan Bermotor,1030709450,
1.07.1.07.01.20.03,Pelaksanaan Uji Kendaraan Bermotor,24806950,"Uji petik 500 kendaraan, pengujian kendaraan 18000"
1.07.1.07.01.20.05,Pelayanan Uji Kendaraan Bermotor,864990000,Pengujian kendaraan 18000
1.07.1.07.01.20.06,Pembinaan Perbengkelan,41992500,"Terbinanya usaha perbengkelan, 75 bengkel"
1.07.1.07.01.20.07,Perawatan Alat Uji Kendaraan Bermotor,98820000,"Perbaikan dan pemeliharaan alat uji, 9 unit"
1.03.1.07.01,Pekerjaan Umum,198710000,
1.03.1.07.01.31, Pembangunan dan Rehabilitasi Gedung Pemerintah,198710000,
1.03.1.07.01.31.01,Perencanaan Gedung,198710000,"Penyusunan DED, 1 dokumen"
1.06.1.07.01,Perencanaan Pembangunan,37626000,
1.06.1.07.01.21, Perencanaan Pembangunan Daerah,37626000,
1.20.1.07.01,"Otonomi Daerah, Pem. Umum, Adm Keu Daerah, Kepegawaian, dan Persandian",7919875925,
1.20.1.07.01.17, Peningkatan Pengembangan Pengelolaan Keuangan dan Kekayaan Daerah,113204500,
1.20.1.07.01.20, Peningkatan Sistem Pengawasan Internal dan Pengendalian Pelaksanaan Kebijakan KDH,25756925,
1.20.1.07.01.23, Optimalisasi Pemanfaatan Teknologi Informasi,7709321500,"Pengelolaan aplikasi layanan aparat dan masyarakat, 20 aplikasi data base pendukung Untuk kelancaran e-gov"
1.20.1.07.01.28, Pendidikan Kedinasan,24870000,Bimtek pengelolaan jaringan komputer 40 orang dan pengelolaan wbsite 40 orang
1.20.1.07.01.37, Penegakan Hukum,46723000,"Oprasi penegakan hukum, 12 bulan"
1.24.1.07.01,Kearsipan,28653000,
1.24.1.07.01.18, Peningkatan Kualitas Pelayanan Informasi,28653000,
1.25.1.07.01,Komunikasi dan Informatika,458919000,
1.25.1.07.01.15," Pengembangan Komunikasi, Informasi dan Media Massa",458919000,Manajemen dan Operasional LPSE. 12 bln
